### ISSUE TITLE
Libwebsocket : not able to receive the request from client

### ISSUE THREAD

**Issue by CVVDN-S** [warmcat/libwebsockets#2248]
Hi, 
Im trying to send bulk data from file through websocket. From client http call for Websocket Upgradation is received. Server and Client are connected. Then Client sends Websocket Text and waits for server to send back data. With my server im not able to receive this Websocket Text from the Client
Im using the Callback in the protocols defined. I even tried adding the callback in extensions but no calls are being received there.

**This is the server code :** 
int main(int argc, const char **argv)
{
        struct lws_context_creation_info info;
	struct lws_context *context;
        const char *p;
        int n = 0, logs = LLL_USER | LLL_ERR | LLL_WARN | LLL_NOTICE
                        /* for LLL_ verbosity above NOTICE to be built into lws,
                         * lws must have been configured and built with
                         * -DCMAKE_BUILD_TYPE=DEBUG instead of =RELEASE */
                        /* | LLL_INFO */ /* | LLL_PARSER */ /* | LLL_HEADER */
                        /* | LLL_EXT */ /* | LLL_CLIENT */ /* | LLL_LATENCY */
                        /* | LLL_DEBUG */;

        signal(SIGINT, sigint_handler);

        if ((p = lws_cmdline_option(argc, argv, "-d")))
                logs = atoi(p);

        lws_set_log_level(logs, NULL);
        lwsl_user("LWS minimal ws server + permessage-deflate | visit http://localhost:8080\n");
        lwsl_user("   %s [-n (no exts)] [-c (compressible)] [-b (blob)]\n", argv[0]);

        memset(&info, 0, sizeof info); /* otherwise uninitialized garbage */
        info.port = 8080;
        info.mounts = &mount;
        info.protocols = protocols;
        info.pvo = &pvo;
        info.options =
                LWS_SERVER_OPTION_HTTP_HEADERS_SECURITY_BEST_PRACTICES_ENFORCE;
        info.extensions = extensions;

        info.pt_serv_buf_size = 32 * 1024;
        context = lws_create_context(&info);
        if (!context) {
                lwsl_err("lws init failed\n");
                return 1;
        }
        while (n >= 0 && !interrupted)
                n = lws_service(context, 0);
        lws_context_destroy(context);
        return 0;
}

**Commands received as the Server is executed and it is as follows :** 

[2021/03/24 16:05:54:3616] U: LWS minimal ws server + permessage-deflate | visit http://localhost:8080
[2021/03/24 16:05:54:3619] U:    ./lws-minimal-ws-server-pmd-bulk [-n (no exts)] [-c (compressible)] [-b (blob)]
[2021/03/24 16:05:54:3619] N: LWS: 4.1.99-v4.1.0-330-ge400b96, loglevel 1031
[2021/03/24 16:05:54:3619] N: NET CLI SRV H1 H2 WS IPv6-absent
[2021/03/24 16:05:54:3622] N:  ++ [wsi|0|pipe] (1)
[2021/03/24 16:05:54:3623] N:  ++ [vh|0|netlink] (1)
[2021/03/24 16:05:54:3624] N:  ++ [vh|1|default||8080] (2)
[2021/03/24 16:05:54:3626] N: lws_socket_bind: nowsi: source ads 0.0.0.0
[2021/03/24 16:05:54:3626] N:  ++ [wsi|1|listen|default||8080] (2)
REASON : 27
REASON : 71 
REASON : 71 
REASON : 71 
[2021/03/24 16:06:20:4226] N:  ++ [wsisrv|0|adopted] (1)
REASON : 71 

Reason 71 is LWS_CALLBACK_EVENT_WAIT_CANCELLED, i'm not receiving any other callback reason

**This is the data from Client in wireshark:**
Transmission Control Protocol, Src Port: 54274, Dst Port: 8080, Seq: 516, Ack: 130, Len: 68
WebSocket
    1... .... = Fin: True
    .000 .... = Reserved: 0x0
    .... 0001 = Opcode: Text (1)
    1... .... = Mask: True
    .011 1110 = Payload length: 62
    Masking-Key: 5f79a3fc
    Masked payload
    Payload
Line-based text data (1 lines)
    {"url":"ws://127.0.0.1:8080/video/h265_high.mp4","cmd":"size"}

How can i receive the Websocket Text sent from client?

**Comment by lws-team** [comment]
>     info.extensions = extensions;

remove this as already suggested

what is the name of your ws subprotocol?  Because lws matches the connection to the struct lws_protocols with the .name that matches the subprotocol name that was negotiated.

**Comment by CVVDN-S** [comment]
I even tried without  info.extensions = extensions;

**Comment by lws-team** [comment]
When you create the ws link from js, you can specify the name of the ws subprotocol to use.

https://developer.mozilla.org/en-US/docs/Web/API/WebSocket

So for example, you can open

```
const socket = new WebSocket('ws://localhost:8080', "lws-minimal-pmd-bulk");
```

This will bind your ws to the same named protocol on lws side, so the callbacks come where you are expecting.

**Comment by CVVDN-S** [comment]
Hi, 
I was able to send data through websocket. But there is one issue, after 10th data write, data received at the client side seems to be corrupted. 
**Is there any method to add delay  in receiving the callback request?**.

This is the code used to write  :
switch(reason)
        {
                case LWS_CALLBACK_SERVER_NEW_CLIENT_INSTANTIATED:
                        printf("\r\nA new client is connected into the pool");
                        if (lws_partial_buffered(wsi) != 1) {
                                lws_write(wsi, buffer, strlen(buffer), LWS_WRITE_BINARY);
                                lws_callback_on_writable_all_protocol(lws_get_context(wsi), lws_get_protocol(wsi));
                        }
                        break;
                case LWS_CALLBACK_RECEIVE: 
                        if(first_call_flag == 0) {
                                memcpy(data, in, len);          // To check the input cmd
                                flags = lws_write_ws_flags(LWS_WRITE_BINARY, 1, 0);
                                first_call_flag = 1;
                                fp1 = open("./video/test_ref.mp4", O_CREAT | O_RDWR , 0777);
                                if(fp1 < 0)
                                        return -1;
                                file_size = lseek(fp1, 0, SEEK_END);
                                ret = lseek(fp1, 0, SEEK_SET);
                                /*fp = open("./video/test_h265.mp4", O_CREAT | O_RDWR , 0777);
                                if(fp < 0)
                                        return -1;*/
                                memcpy(file_size_buf, (char *)&file_size, 4);
                                memcpy(&buffer[LWS_PRE], file_size_buf, 4);
                                lws_write(wsi, &buffer[LWS_PRE], 4, LWS_WRITE_BINARY);
                        } else {
                                memset(samp_buf, '\0', MESSAGE_CHUNK_RD);
                                ret = read(fp1, &samp_buf, MESSAGE_CHUNK_RD);
                                //ret = write(fp, &samp_buf, MESSAGE_CHUNK_RD);
                                lws_write(wsi, samp_buf, MESSAGE_CHUNK_RD, LWS_WRITE_BINARY);
                        }
                        lws_callback_on_writable_all_protocol(lws_get_context(wsi), lws_get_protocol(wsi));
                        break;
                default:
                        break;
        }

**Comment by lws-team** [comment]
You can't do this:

```
case LWS_CALLBACK_SERVER_NEW_CLIENT_INSTANTIATED:
printf("\r\nA new client is connected into the pool");
if (lws_partial_buffered(wsi) != 1) {
lws_write(wsi, buffer, strlen(buffer), LWS_WRITE_BINARY);
```

the only safe place for lws_write() is inside the _WRITEABLE callback as shown in every example.  You can ask there for a lws_callback_on_writable() and some time later do the write in the _WRITEABLE callback.

You cannot randomly do the lws_write in RECEIVE cb either, again you must ask for a writeable callback and do the write when you get one.

You're writing the code like it is blocking, with a single buffer holding data.  But it is asynchronous and nonblocking, there is nothing stopping two or more RECEIVEs before you get a chance to write.  So you must use a ringbuffer or linked-list capable to hold multiple things, look through the examples and follow how they do things.
