### ISSUE TITLE
websockets connection closed with LWS_SSL_CAPABLE_ERROR

### ISSUE THREAD

**Issue by achuprynov** [warmcat/libwebsockets#3543]
Hi. After about 2 minutes websocket connection is closed. Before I successfully logon and subscribe to user data stream on wss://ws-api.testnet.binance.vision:443/ws-api/v3. Below log of libwebsockets and tcpdump. I may send full log If needed. Binance exchange requires answer for ping request with ping payload. Log of libwebsockets tell that pong response was sent with payload. Please, tell me reason of this issue.

libwebsockets trace log
[2026/01/31 09:42:01:9359] I: [wsicli|0|WS/h1/default/ws-api.testnet.binance.vision]: lws_ws_client_rx_sm: received 13 byte ping, sending pong
[2026/01/31 09:42:01:9360] I: issuing pong 13 on [wsicli|0|WS/h1/default/ws-api.testnet.binance.vision]
[2026/01/31 09:42:01:9361] I: [wsicli|0|WS/h1/default/ws-api.testnet.binance.vision]: lws_issue_raw: ssl_capable_write (19) says 19

tcpdump -ni ens33
09:42:01.935818 IP 18.177.25.228.https > 192.168.27.134.53872: Flags [P.], seq 38:75, ack 42, win 64240, length 37
09:42:01.936072 IP 192.168.27.134.53872 > 18.177.25.228.https: Flags [P.], seq 42:83, ack 75, win 46720, length 41
09:42:01.936379 IP 18.177.25.228.https > 192.168.27.134.53872: Flags [.], ack 83, win 64240, length 0

libwebsockets trace log
[2026/01/31 09:42:33:7039] I: rops_handle_POLLIN_ws: LWS_SSL_CAPABLE_ERROR
[2026/01/31 09:42:33:7039] I: [wsicli|0|WS/h1/default/ws-api.testnet.binance.vision]: __lws_close_free_wsi: caller: close_and_handled
[2026/01/31 09:42:33:7039] I: [wsicli|0|WS/h1/default/ws-api.testnet.binance.vision]: __lws_close_free_wsi: real just_kill_connection: sockfd 11
[2026/01/31 09:42:33:7039] I: [wsicli|0|WS/h1/default/ws-api.testnet.binance.vision]: __lws_close_free_wsi: cce=1
[2026/01/31 09:42:33:7040] I: lws_tls_restrict_return: 1 → 0
[2026/01/31 09:42:33:7040] I: __lws_lc_untag: – [wsicli|0|WS/h1/default/ws-api.testnet.binance.vision] (0) 1:59min
[2026/01/31 09:42:33:7040] I: : lws_client_connect_via_info: role binding to h1
[2026/01/31 09:42:33:7040] I: : lws_client_connect_via_info: vh default protocol binding to
[2026/01/31 09:42:33:7040] I: : lws_client_connect_via_info: : h1 entry

tcpdump -ni ens33
09:42:05.369759 IP 10.10.10.7.pcsync-https > 192.168.27.134.50316: Flags [R.], seq 87322114, ack 1645905829, win 64240, length 0
09:42:11.938486 IP 192.168.27.134.53872 > 18.177.25.228.https: Flags [.], ack 75, win 46720, length 0
09:42:13.942253 IP 192.168.27.134.53872 > 18.177.25.228.https: Flags [.], ack 75, win 46720, length 0
09:42:13.942401 IP 18.177.25.228.https > 192.168.27.134.53872: Flags [.], ack 83, win 64240, length 0
09:42:23.970455 IP 192.168.27.134.53872 > 18.177.25.228.https: Flags [.], ack 75, win 46720, length 0
09:42:23.970653 IP 18.177.25.228.https > 192.168.27.134.53872: Flags [.], ack 83, win 64240, length 0
09:42:33.703831 IP 18.177.25.228.https > 192.168.27.134.53872: Flags [R.], seq 75, ack 83, win 64240, length 0
09:42:33.704234 IP 192.168.27.134.43123 > 192.168.27.2.domain: 18676+ A? ws-api.testnet.binance.vision. (47)
09:42:33.704349 IP 192.168.27.134.43123 > 192.168.27.2.domain: 13567+ AAAA? ws-api.testnet.binance.vision. (47)

**Comment by lws-team** [comment]
I dunno, I am not binance tech support.

Does the example app work well without an account (because I don't have an account and cannot even try your situation) or have the same problem?

**Comment by achuprynov** [comment]
Issue is solved.
