### ISSUE TITLE
how to use the ping-pong?

### ISSUE THREAD

**Issue by BambooAce** [warmcat/libwebsockets#1151]
Hello
      Recently, I tried to use ping-pong to keep longer connection.  I  modified test-apps/test-echo.c to test it . Client send Ping to server. Add ws_ping_pong_interval  and timeout_secs in client. 
```
#ifndef LWS_NO_CLIENT
	info.ws_ping_pong_interval = 8;
	info.timeout_secs = 4;
#endif
```
Then run server without SSL. run client like this : `./libwebsockets-test-echo -c 127.0.0.1 -p 7681 -r 40000`
server log 
```
[2802]: libwebsockets test server echo - license LGPL2.1+SLE
lwsts[2802]: (C) Copyright 2010-2016 Andy Green <andy@warmcat.com>
lwsts[2802]: Running in server mode
lwsts[2802]: libuv support not compiled in
lwsts[2802]: Creating Vhost 'default' port 7681, 1 protocols, IPv6 off
lwsts[2802]: lws_write: suspicious len int -1, ulong 4294967295
lwsts[2802]: ERROR -1 writing to socket, hanging up

```

 Network package:
```
127.0.0.1.57988 > 127.0.0.1.7681: Flags [P.], cksum 0xff6d (incorrect -> 0x1942), seq 1:326, ack 1, win 342, options [nop,nop,TS val 232962 ecr 232962], length 325
E..y..@.@.Q..............{g........V.m.....
........GET / HTTP/1.1
Pragma: no-cache
Cache-Control: no-cache
Host: 127.0.0.1:7681
Origin: http://127.0.0.1:7681
Upgrade: websocket
Connection: Upgrade
Sec-WebSocket-Key: 1lVr0wzPa5/tOi9E3Bdrvg==
Sec-WebSocket-Extensions: permessage-deflate; client_no_context_takeover; client_max_window_bits
Sec-WebSocket-Version: 13


21:25:49.357532 IP (tos 0x0, ttl 64, id 38169, offset 0, flags [DF], proto TCP (6), length 52)
    127.0.0.1.7681 > 127.0.0.1.57988: Flags [.], cksum 0xfe28 (incorrect -> 0xd05b), seq 1, ack 326, win 350, options [nop,nop,TS val 232962 ecr 232962], length 0
E..4..@.@....................{i....^.(.....
........
21:25:49.357711 IP (tos 0x0, ttl 64, id 38170, offset 0, flags [DF], proto TCP (6), length 227)
    127.0.0.1.7681 > 127.0.0.1.57988: Flags [P.], cksum 0xfed7 (incorrect -> 0x44c4), seq 1:176, ack 326, win 350, options [nop,nop,TS val 232962 ecr 232962], length 175
E.....@.@....................{i....^.......
........HTTP/1.1 101 Switching Protocols
Upgrade: WebSocket
Connection: Upgrade
Sec-WebSocket-Accept: uyZ2UpRa41t0YzZm2lPY+2bLnJ0=
Sec-WebSocket-Extensions: permessage-deflate


21:25:49.357740 IP (tos 0x0, ttl 64, id 59840, offset 0, flags [DF], proto TCP (6), length 52)
    127.0.0.1.57988 > 127.0.0.1.7681: Flags [.], cksum 0xfe28 (incorrect -> 0xcfac), seq 326, ack 176, win 350, options [nop,nop,TS val 232962 ecr 232962], length 0
E..4..@.@.S..............{i........^.(.....
........
21:25:58.007589 IP (tos 0x0, ttl 64, id 59841, offset 0, flags [DF], proto TCP (6), length 58)
    127.0.0.1.57988 > 127.0.0.1.7681: Flags [P.], cksum 0xfe2e (incorrect -> 0x7d8b), seq 326:332, ack 176, win 350, options [nop,nop,TS val 235125 ecr 232962], length 6
E..:..@.@.R..............{i........^.......
...u......(..B
21:25:58.007595 IP (tos 0x0, ttl 64, id 38171, offset 0, flags [DF], proto TCP (6), length 54)
    127.0.0.1.7681 > 127.0.0.1.57988: Flags [P.], cksum 0xfe2a (incorrect -> 0x3e2f), seq 176:178, ack 326, win 350, options [nop,nop,TS val 235125 ecr 232962], length 2
E..6..@.@....................{i....^.*.....
...u......
21:25:58.007629 IP (tos 0x0, ttl 64, id 59842, offset 0, flags [DF], proto TCP (6), length 52)
    127.0.0.1.57988 > 127.0.0.1.7681: Flags [.], cksum 0xfe28 (incorrect -> 0xbebe), seq 332, ack 178, win 350, options [nop,nop,TS val 235125 ecr 235125], length 0
E..4..@.@.R..............{i........^.(.....
...u...u
21:25:58.007784 IP (tos 0x0, ttl 64, id 38172, offset 0, flags [DF], proto TCP (6), length 52)
    127.0.0.1.7681 > 127.0.0.1.57988: Flags [F.], cksum 0xfe28 (incorrect -> 0xbebd), seq 178, ack 332, win 350, options [nop,nop,TS val 235125 ecr 235125], length 0
E..4..@.@....................{i....^.(.....
...u...u
```

Why server will go to lws_write and the reason argument equal LWS_CALLBACK_SERVER_WRITEABLE?   What's wrong with my test? 

Thanks.

**Comment by lws-team** [comment]
Putting aside whatever happened with your echo test, the test apps allow you to test ping / pong already.

In one window just run `libwebsockets-test-server`.  In another window `libwebsockets-test-client -P 5 -n localhost -d 15` (ping-pong every 5s, don't do the mirror traffic, debug level shows INFO).

You will see like

```
...
[2018/01/12 08:39:36:9058] INFO: lws_read: 0x23aaa80: read_ok, used 4 (len 4, state 229)
[2018/01/12 08:39:37:0061] INFO: req pp on wsi 0x23ba6e0
[2018/01/12 08:39:37:0062] INFO: lws_callback_on_writable: 0x23ba6e0
[2018/01/12 08:39:37:0063] INFO: rx 2 '65'
[2018/01/12 08:39:37:0064] INFO: lws_read: 0x23aaa80: read_ok, used 4 (len 4, state 229)
[2018/01/12 08:39:37:0064] INFO: issuing ping on wsi 0x23ba6e0  <<<<--
[2018/01/12 08:39:37:0065] INFO: lws_handle_POLLOUT_event: non http2
[2018/01/12 08:39:37:0067] INFO: client receied pong    <<<<--
[2018/01/12 08:39:37:0067] INFO: 0x23ba6e0: received expected PONG  <<<<--
[2018/01/12 08:39:37:0067] INFO: lws_read: 0x23ba6e0: read_ok, used 2 (len 2, state 229)
[2018/01/12 08:39:37:0571] INFO: rx 2 '66'
...
```

You might need to build with `cmake .. -DCMAKE_BUILD_TYPE=DEBUG` to get the INFO logging.

**Comment by BambooAce** [comment]
Yeah, the libwebsockets-test-server ping-pong is work. But the echo-test and my project always failed.  I saw the libwebsockets-test-server/client source code, the use of ping-pong just set ws_ping_pong_interval and timeout_secs item, my project do this too, Like echo-test, whether  I miss other option for lws_context_creation_info?

**Comment by lws-team** [comment]
It's only that test-echo wrongly expects he'll **only** get a WRITABLE callback when he will have something to send.  I pushed this on v2.4-stable and master

```
diff --git a/test-apps/test-echo.c b/test-apps/test-echo.c
index 0691b04bb..ab75e19ba 100644
--- a/test-apps/test-echo.c
+++ b/test-apps/test-echo.c
@@ -73,7 +73,8 @@ callback_echo(struct lws *wsi, enum lws_callback_reasons reason, void *user,
 
        case LWS_CALLBACK_SERVER_WRITEABLE:
 do_tx:
-
+               if ((int)pss->len == -1)
+                       break;
                n = LWS_WRITE_CONTINUATION;
                if (!pss->continuation) {
                        if (pss->binary)
```

and there is no problem any more.

Basically when lws writes the PING or PONG he isn't sure if he is using up an existing request for a writable callback.  So he always asks for another one just in case.  Then you can get an extra WRITABLE callback, and need to understand it came when you had nothing to do and just return.

**Comment by BambooAce** [comment]
Oh!  I know,  Thanks very much.
