### ISSUE TITLE
why upgrade http to websocket do not repsonse

### ISSUE THREAD

**Issue by duguhaotian** [warmcat/libwebsockets#3023]
i use [crictl ](https://github.com/kubernetes-sigs/cri-tools) with websocket to test websocket server.

and tcpdump to listen http information, i got upgrade request, and server run LWS_CALLBACK_HTTP_CONFIRM_UPGRADE callback, but after callback, server close socket, and crictl client got a "unexpected EOF". tcpdump info like below:
```
08:03:12.743945 IP localhost.55832 > localhost.10350: Flags [.], ack 1, win 512, options [nop,nop,TS val 960821087 ecr 960821087], length 0
E..4..@.@.6...........(n.3...........(.....
9D._9D._
08:03:12.744089 IP localhost.55832 > localhost.10350: Flags [P.], seq 1:303, ack 1, win 512, options [nop,nop,TS val 960821087 ecr 960821087], length 302
E..b..@.@.5...........(n.3...........V.....
9D._9D._GET /cri/exec/NWI5MDNjODJhY2FjMWQ5YTU4Y2FjMjI0OWQ2N2FjY2UyMzFlNjRmZWU1NDkyZWNi HTTP/1.1
Host: localhost:10350
User-Agent: Go-http-client/1.1
Connection: Upgrade
Sec-WebSocket-Key: b1toBmS0Ia8gvxJTwoEiLA==
Sec-WebSocket-Protocol: v5.channel.k8s.io
Sec-WebSocket-Version: 13
Upgrade: websocket

08:03:12.744098 IP localhost.10350 > localhost.55832: Flags [.], ack 303, win 510, options [nop,nop,TS val 960821087 ecr 960821087], length 0
E..4..@.@.A.........(n.......3.......(.....
9D._9D._
08:03:12.744216 IP localhost.10350 > localhost.55832: Flags [F.], seq 1, ack 303, win 512, options [nop,nop,TS val 960821087 ecr 960821087], length 0
E..4..@.@.A.........(n.......3.......(.....
9D._9D._
08:03:12.744294 IP localhost.55832 > localhost.10350: Flags [F.], seq 303, ack 2, win 512, options [nop,nop,TS val 960821087 ecr 960821087], length 0
E..4..@.@.6...........(n.3...........(.....
9D._9D._
08:03:12.744329 IP localhost.10350 > localhost.55832: Flags [.], ack 304, win 512, options [nop,nop,TS val 960821087 ecr 960821087], length 0
E..4..@.@.A.........(n.......3.......(.....
9D._9D._
```

crictl got error:
```
crictl -D exec -ti b277916602c7 -- date
DEBU[0000] get runtime connection
DEBU[0000] ExecRequest: &ExecRequest{ContainerId:b277916602c7,Cmd:[-- date],Tty:true,Stdin:true,Stdout:true,Stderr:false,}
DEBU[0000] ExecResponse: &ExecResponse{Url:http://localhost:10350/cri/exec/NWI5MDNjODJhY2FjMWQ5YTU4Y2FjMjI0OWQ2N2FjY2UyMzFlNjRmZWU1NDkyZWNi,}
DEBU[0000] Exec URL: http://localhost:10350/cri/exec/NWI5MDNjODJhY2FjMWQ5YTU4Y2FjMjI0OWQ2N2FjY2UyMzFlNjRmZWU1NDkyZWNi
DEBU[0000] StreamOptions: {0xc000012010 0xc000012018 0xc000012020 true <nil>}
FATA[0000] execing command in container: unable to upgrade streaming request: unexpected EOF
```

server code:
```
int WebsocketServer::HttpCallback(struct lws *wsi, enum lws_callback_reasons reason, void *user, void *in, size_t len)
{
    std::string routePath[] = {
        "/exec/",
        "/attach/",
        "/portforward/"
    };

    ERROR("----http get reason: %d", reason);
	switch (reason) {
    case LWS_CALLBACK_HTTP_CONFIRM_UPGRADE: {
        const size_t max_ws_token_size = 1024;
        char buf[max_ws_token_size] = { 0 };
        const unsigned char *key = nullptr;

        key = lws_token_to_string(WSI_TOKEN_UPGRADE);
        GetWsToken(wsi, buf, max_ws_token_size, WSI_TOKEN_UPGRADE);
        ERROR("===in: %s, get header: %s = %s", static_cast<const char *>(in), key, buf);
        key = lws_token_to_string(WSI_TOKEN_PROTOCOL);
        GetWsToken(wsi, buf, max_ws_token_size, WSI_TOKEN_PROTOCOL);
        ERROR("===get header: %s = %s", key, buf);

// i test return 0, -1, 1, but got same result
        return 0;
    }
	case LWS_CALLBACK_HTTP:
        ERROR("---get http--%s", (const char *)in);
        for (auto &&pstr : routePath) {
            if (strncmp((const char *)in, pstr.c_str(), pstr.size()) == 0) {
                return 0;
            }
        }
	default:
		break;
	}

	return lws_callback_http_dummy(wsi, reason, user, in, len);
}

// set protocols
const struct lws_protocols m_protocols[MAX_PROTOCOL_NUM] = {
        { "http", HttpCallback, 0, MAX_ECHO_PAYLOAD, 0, nullptr, 0 },
        { "v5.channel.k8s.io", WsCallback, 0, MAX_ECHO_PAYLOAD, 0, nullptr, 0 },
        { nullptr, nullptr, 0, 0, 0, nullptr, 0 },
 };
```

**Comment by duguhaotian** [comment]
read crictl code:
```
//vendor/github.com/gorilla/websocket/client.go
func (d *Dialer) DialContext(ctx context.Context, urlStr string, requestHeader http.Header) (*Conn, *http.Response, error) {
	req := &http.Request{
		Method:     http.MethodGet,
		URL:        u,
		Proto:      "HTTP/1.1",
		ProtoMajor: 1,
		ProtoMinor: 1,
		Header:     make(http.Header),
		Host:       u.Host,
	}
	req = req.WithContext(ctx)

	// Set the request headers using the capitalization for names and values in
	// RFC examples. Although the capitalization shouldn't matter, there are
	// servers that depend on it. The Header.Set method is not used because the
	// method canonicalizes the header names.
	req.Header["Upgrade"] = []string{"websocket"}
	req.Header["Connection"] = []string{"Upgrade"}
	req.Header["Sec-WebSocket-Key"] = []string{challengeKey}
	req.Header["Sec-WebSocket-Version"] = []string{"13"}
	if len(d.Subprotocols) > 0 {
		req.Header["Sec-WebSocket-Protocol"] = []string{strings.Join(d.Subprotocols, ", ")}
	}
	for k, vs := range requestHeader {
		switch {
		case k == "Host":
			if len(vs) > 0 {
				req.Host = vs[0]
			}
		case k == "Upgrade" ||
			k == "Connection" ||
			k == "Sec-Websocket-Key" ||
			k == "Sec-Websocket-Version" ||
			k == "Sec-Websocket-Extensions" ||
			(k == "Sec-Websocket-Protocol" && len(d.Subprotocols) > 0):
			return nil, nil, errors.New("websocket: duplicate header not allowed: " + k)
		case k == "Sec-Websocket-Protocol":
			req.Header["Sec-WebSocket-Protocol"] = vs
		default:
			req.Header[k] = vs
		}
	}

	netConn, err := netDial("tcp", hostPort)


	conn := newConn(netConn, false, d.ReadBufferSize, d.WriteBufferSize, d.WriteBufferPool, nil, nil)

	if err := req.Write(netConn); err != nil {
		return nil, nil, err
	}

/////==========> error at here ===================
	resp, err := http.ReadResponse(conn.br, req)
	if err != nil {
		return nil, nil, err
	}
```

**Comment by lws-team** [comment]
Lws wants to show you detailed logs about everything.

If you want to know what's going on from lws perspective, crank up the verbosity of the logs and read them?

**Comment by duguhaotian** [comment]
> Lws wants to show you detailed logs about everything.
> 
> If you want to know what's going on from lws perspective, crank up the verbosity of the logs and read them?

thk you reply, i got the logs:
```
ws:[2023/11/30 21:50:10:6606] D: accepted new conn port 37030 on fd=20

ws:[2023/11/30 21:50:10:6607] D: lws_get_idlest_tsi: 3 10239

ws:[2023/11/30 21:50:10:6607] D: _realloc: size 1520: __lws_wsi_create_with_role

ws:[2023/11/30 21:50:10:6607] D: : lws_role_transition: wsistate 0x200, ops (unset)

ws:[2023/11/30 21:50:10:6607] N: __lws_lc_tag:  ++ [wsisrv|0|adopted] (1)

ws:[2023/11/30 21:50:10:6607] D: [wsisrv|0|adopted]: lws_create_new_server_wsi: joining vh default, tsi 0

ws:[2023/11/30 21:50:10:6607] D: [wsisrv|0|adopted]: lws_vhost_bind_wsi: vh default: wsi none/none, count_bound_wsi 2

ws:[2023/11/30 21:50:10:6607] D: [wsisrv|0|adopted]: lwsi_set_state: lwsi_set_state 0x20000200 -> 0x20000200

ws:[2023/11/30 21:50:10:6607] D: [wsisrv|0|adopted]: lws_role_transition: wsistate 0x20000016, ops h1

ws:[2023/11/30 21:50:10:6608] D: [wsisrv|0|adopted]: __lws_set_timeout: 15 secs, reason 3

ws:[2023/11/30 21:50:10:6608] D: [wsisrv|0|adopted]: __insert_wsi_socket_into_fds: tsi=0, sock=20, pos-in-fds=3

ws:[2023/11/30 21:50:10:6608] I: lws_header_table_attach: [wsisrv|0|adopted]: ah (nil) (tsi 0, count = 0) in

ws:[2023/11/30 21:50:10:6608] D: _realloc: size 984: ah struct

ws:[2023/11/30 21:50:10:6608] D: _realloc: size 4096: ah data

ws:[2023/11/30 21:50:10:6608] I: _lws_create_ah: created ah 0x7f011c002590 (size 4096): pool length 1

ws:[2023/11/30 21:50:10:6608] D: [wsisrv|0|adopted]: _lws_change_pollfd: fd 20 events 1 -> 1

ws:[2023/11/30 21:50:10:6608] I: lws_header_table_attach: did attach wsi [wsisrv|0|adopted]: ah 0x7f011c002590: count 1 (on exit)

ws:[2023/11/30 21:50:10:6608] D: [wsisrv|0|adopted]: __lws_set_timeout: 10 secs, reason 25

ws:[2023/11/30 21:50:10:6608] D: Attached ah immediately

ws:[2023/11/30 21:50:10:6614] D: rops_handle_POLLIN_h1: [wsisrv|0|adopted]: wsistate 0x20000016

ws:[2023/11/30 21:50:10:6614] D: [wsisrv|0|adopted]: lws_buflist_aware_read: lws_h1_server_socket_service: ssl_capable_read 302

ws:[2023/11/30 21:50:10:6614] D: lws_read_h1: h1 path: wsi state 0x16

ws:[2023/11/30 21:50:10:6614] I: lws_handshake_server: parsed count 302

ws:[2023/11/30 21:50:10:6614] I: lws_select_vhost: vhost match to default based on port 10350

ws:[2023/11/30 21:50:10:6614] D: [wsisrv|0|adopted]: lwsi_set_state: lwsi_set_state 0x20000016 -> 0x2000020a

ws:[2023/11/30 21:50:10:6615] I: __lws_header_table_detach: [wsisrv|0|adopted]: ah 0x7f011c002590 (tsi=0, count = 1)

ws:[2023/11/30 21:50:10:6615] I: __lws_header_table_detach: nobody usable waiting

ws:[2023/11/30 21:50:10:6615] I: _lws_destroy_ah: freed ah 0x7f011c002590 : pool length 0

ws:[2023/11/30 21:50:10:6615] I: __lws_header_table_detach: [wsisrv|0|adopted]: ah 0x7f011c002590 (tsi=0, count = 0)

ws:[2023/11/30 21:50:10:6615] I: [wsisrv|0|adopted]: __lws_close_free_wsi: caller: lws_read_h1 bail

ws:[2023/11/30 21:50:10:6615] D: [wsisrv|0|adopted]: __lws_close_free_wsi: real just_kill_connection A: (sockfd 20)

ws:[2023/11/30 21:50:10:6615] I: __lws_close_free_wsi: shutdown conn: [wsisrv|0|adopted] (sk 20, state 0x20a)

ws:[2023/11/30 21:50:10:6615] I: [wsisrv|0|adopted]: __lws_close_free_wsi: real just_kill_connection: sockfd 20

ws:[2023/11/30 21:50:10:6616] D: [wsi|1|listen|default|127.0.0.1|10350]: _lws_change_pollfd: fd 15 events 1 -> 1

ws:[2023/11/30 21:50:10:6616] D: [wsisrv|0|adopted]: lwsi_set_state: lwsi_set_state 0x2000020a -> 0x20000020

ws:[2023/11/30 21:50:10:6616] I: [wsisrv|0|adopted]: __lws_close_free_wsi: cce=0

ws:[2023/11/30 21:50:10:6616] D: [wsisrv|0|adopted]: __lws_close_free_wsi_final: fd 20

ws:[2023/11/30 21:50:10:6616] D: [wsi|1|listen|default|127.0.0.1|10350]: _lws_change_pollfd: fd 15 events 1 -> 1

ws:[2023/11/30 21:50:10:6616] I: rops_destroy_role_h1: ah det due to close

ws:[2023/11/30 21:50:10:6616] D: [wsisrv|0|adopted]: __lws_vhost_unbind_wsi: vh default: count_bound_wsi 1

ws:[2023/11/30 21:50:10:6616] D: [wsisrv|0|adopted]: __lws_free_wsi: tsi fds count 3

ws:[2023/11/30 21:50:10:6617] N: __lws_lc_untag:  -- [wsisrv|0|adopted] (0) 937μs
```

**Comment by lws-team** [comment]
Turn on all the logging, like 0xffff?  You should see it parsing.

**Comment by duguhaotian** [comment]
> Turn on all the logging, like 0xffff? You should see it parsing.

tks i use new version fix this problew.

**Comment by duguhaotian** [comment]
sorry, a new question need your help. my server can transform data with client. But, when server finish to close connection, client got a  error: `unexpected EOF`.

server information by `tcpdump -i lo -A -s 0 'tcp port 10350'`  : 
```
07:42:43.161022 IP localhost.10350 > localhost.34604: Flags [P.], seq 173:206, ack 336, win 512, options [nop,nop,TS val 1391591504 ecr 1391591443], length 33
E..U..@.@.p.........(n.,.....Y.......I.....
R..PR......Tue Dec  5 12:42:43 UTC 2023

07:42:43.201062 IP localhost.34604 > localhost.10350: Flags [.], ack 206, win 512, options [nop,nop,TS val 1391591544 ecr 1391591504], length 0
E..4.J@.@.jw.........,(n.Y...........(.....
R..xR..P
07:42:43.262062 IP localhost.10350 > localhost.34604: Flags [P.], seq 206:243, ack 336, win 512, options [nop,nop,TS val 1391591605 ecr 1391591544], length 37
E..Y..@.@.p.........(n.,.....Y.......M.....
R...R..x.#.{"ErrStatus":{"status":"Success"}}
07:42:43.262070 IP localhost.34604 > localhost.10350: Flags [.], ack 243, win 512, options [nop,nop,TS val 1391591605 ecr 1391591605], length 0
E..4.K@.@.jv.........,(n.Y...........(.....
R...R...
07:42:43.262099 IP localhost.10350 > localhost.34604: Flags [F.], seq 243, ack 336, win 512, options [nop,nop,TS val 1391591605 ecr 1391591605], length 0
E..4..@.@.p.........(n.,.....Y.......(.....
R...R...
07:42:43.262207 IP localhost.34604 > localhost.10350: Flags [F.], seq 336, ack 244, win 512, options [nop,nop,TS val 1391591605 ecr 1391591605], length 0
E..4.L@.@.ju.........,(n.Y...........(.....
R...R...
07:42:43.262229 IP localhost.10350 > localhost.34604: Flags [.], ack 337, win 512, options [nop,nop,TS val 1391591605 ecr 1391591605], length 0
E..4..@.@.p.........(n.,.....Y.......(.....
R...R...
```

client information:
```
crictl -D exec -w -it b277916602c7 date
DEBU[0000] get runtime connection
DEBU[0000] ExecRequest: &ExecRequest{ContainerId:b277916602c7,Cmd:[date],Tty:true,Stdin:true,Stdout:true,Stderr:false,}
DEBU[0000] ExecResponse: &ExecResponse{Url:http://localhost:10350/cri/exec/MTViMTEzYmI2Y2E1OGEzZjlhZmQ2M2Y0MjdhNmVhNWU1ODdiMTU1YzdmZmVjOWEw,}
DEBU[0000] Exec URL: http://localhost:10350/cri/exec/MTViMTEzYmI2Y2E1OGEzZjlhZmQ2M2Y0MjdhNmVhNWU1ODdiMTU1YzdmZmVjOWEw
DEBU[0000] StreamOptions: {0xc000012010 0xc000012018 0xc000012020 true <nil>}
Tue Dec  5 12:42:43 UTC 2023
E1205 07:42:43.262152 1303419 v2.go:150] next reader: websocket: close 1006 (abnormal closure): unexpected EOF
                                                                                                              E1205 07:42:43.262164 1303419 v2.go:129] next reader: websocket: close 1006 (abnormal closure): unexpected EOF
                                                                                      FATA[0000] execing command in container: error reading from error stream: next reader: websocket: close 1006 (abnormal closure): unexpected EOF
```

other information: websocket golang library, add a new feature: https://github.com/kubernetes/kubernetes/pull/119157/files

```
// "v5.channel.k8s.io"
//
// The fifth version of the Websocket RemoteCommand subprotocol adds a CLOSE signal,
// which is sent as the first byte of the message. The second byte is the channel
// id. This CLOSE signal is handled by the websocket server by closing the stream,
// allowing the other streams to complete transmission if necessary, and gracefully
// shutdown the connection.
//
// Example client session:
//
//	CONNECT http://server.com with subprotocol "v5.channel.k8s.io"
//	WRITE []byte{0, 102, 111, 111, 10} # send "foo\n" on channel 0 (STDIN)
//	WRITE []byte{255, 0}               # send CLOSE signal (STDIN)
//	CLOSE
```

**Comment by lws-team** [comment]
Again why not look at lws logs to find out how he feels about it.

**Comment by duguhaotian** [comment]
> Again why not look at lws logs to find out how he feels about it.

i check it, but i cannot found useful message

```
ws:[2023/12/05 07:51:56:8887] I: [wsisrv|0|adopted]: _lws_validity_confirmed_role: setting validity timer 300s (hup 0)

ws:[2023/12/05 07:51:56:8887] D: ws established

ws:[2023/12/05 07:51:56:8888] P: accepted v13 connection

ws:[2023/12/05 07:51:56:8888] I: lws_process_ws_upgrade2: [wsisrv|0|adopted]: dropping ah on ws upgrade

ws:[2023/12/05 07:51:56:8888] I: __lws_header_table_detach: [wsisrv|0|adopted]: ah 0x7fea60002e50 (tsi=0, count = 1)

ws:[2023/12/05 07:51:56:8888] I: __lws_header_table_detach: nobody usable waiting

ws:[2023/12/05 07:51:56:8888] I: _lws_destroy_ah: freed ah 0x7fea60002e50 : pool length 0

ws:[2023/12/05 07:51:56:8888] I: __lws_header_table_detach: [wsisrv|0|adopted]: ah 0x7fea60002e50 (tsi=0, count = 0)

ws:[2023/12/05 07:51:56:8888] D: [wsisrv|0|adopted]: _lws_change_pollfd: fd 20 events 5 -> 1

ws:[2023/12/05 07:51:56:8888] D: [wsisrv|0|adopted]: lws_handle_POLLOUT_event: non mux: wsistate 0x20000119, ops ws

ws:[2023/12/05 07:51:56:8888] D: [wsisrv|0|adopted]: _lws_change_pollfd: fd 20 events 1 -> 5

ws:[2023/12/05 07:51:56:8889] D: [wsisrv|0|adopted]: _lws_change_pollfd: fd 20 events 5 -> 1

ws:[2023/12/05 07:51:56:8889] D: [wsisrv|0|adopted]: lws_handle_POLLOUT_event: non mux: wsistate 0x20000119, ops ws

ws:[2023/12/05 07:51:56:8889] D: [wsisrv|0|adopted]: _lws_change_pollfd: fd 20 events 1 -> 5

ws:[2023/12/05 07:51:56:8889] D: [wsisrv|0|adopted]: _lws_change_pollfd: fd 20 events 5 -> 1

ws:[2023/12/05 07:51:56:8889] D: [wsisrv|0|adopted]: lws_handle_POLLOUT_event: non mux: wsistate 0x20000119, ops ws

ws:[2023/12/05 07:51:56:8889] D: [wsisrv|0|adopted]: _lws_change_pollfd: fd 20 events 1 -> 5

ws:[2023/12/05 07:51:56:8889] D: [wsisrv|0|adopted]: _lws_change_pollfd: fd 20 events 5 -> 1
```

**Comment by lws-team** [comment]
This bit of the logs doesn't show anyone closing...

**Comment by duguhaotian** [comment]
> This bit of the logs doesn't show anyone closing...

after this log, have some many same logs, like below:
```
ws:[2023/12/05 07:51:56:8930] D: [wsisrv|0|adopted]: lws_handle_POLLOUT_event: non mux: wsistate 0x20000119, ops ws

ws:[2023/12/05 07:51:56:8930] D: [wsisrv|0|adopted]: _lws_change_pollfd: fd 20 events 1 -> 5

ws:[2023/12/05 07:51:56:8930] D: [wsisrv|0|adopted]: _lws_change_pollfd: fd 20 events 5 -> 1
```

**Comment by duguhaotian** [comment]
> > This bit of the logs doesn't show anyone closing...
> 
> after this log, have some many same logs, like below:
> 
> ```
> ws:[2023/12/05 07:51:56:8930] D: [wsisrv|0|adopted]: lws_handle_POLLOUT_event: non mux: wsistate 0x20000119, ops ws
> 
> ws:[2023/12/05 07:51:56:8930] D: [wsisrv|0|adopted]: _lws_change_pollfd: fd 20 events 1 -> 5
> 
> ws:[2023/12/05 07:51:56:8930] D: [wsisrv|0|adopted]: _lws_change_pollfd: fd 20 events 5 -> 1
> ```

last logs:
```
ws:[2023/12/05 07:51:57:0441] D: [wsisrv|0|adopted]: lws_handle_POLLOUT_event: non mux: wsistate 0x20000119, ops ws

ws:[2023/12/05 07:51:57:0945] I: [wsisrv|0|adopted]: lws_issue_raw: ssl_capable_write (37) says 37

ws:[2023/12/05 07:51:57:0945] D: [wsisrv|0|adopted]: lws_service_fd_tsi: Close and handled

ws:[2023/12/05 07:51:57:0945] I: [wsisrv|0|adopted]: __lws_close_free_wsi: caller: close_and_handled

ws:[2023/12/05 07:51:57:0945] D: [wsisrv|0|adopted]: __lws_close_free_wsi: real just_kill_connection A: (sockfd 20)

ws:[2023/12/05 07:51:57:0945] I: __lws_close_free_wsi: shutdown conn: [wsisrv|0|adopted] (sk 20, state 0x119)

ws:[2023/12/05 07:51:57:0945] I: [wsisrv|0|adopted]: __lws_close_free_wsi: real just_kill_connection: sockfd 20

ws:[2023/12/05 07:51:57:0946] D: [wsi|1|listen|default|127.0.0.1|10350]: _lws_change_pollfd: fd 15 events 1 -> 1

ws:[2023/12/05 07:51:57:0946] D: [wsisrv|0|adopted]: lwsi_set_state: lwsi_set_state 0x20000119 -> 0x20000020

ws:[2023/12/05 07:51:57:0946] I: [wsisrv|0|adopted]: __lws_close_free_wsi: cce=1

ws:[2023/12/05 07:51:57:0947] D: [wsisrv|0|adopted]: __lws_close_free_wsi_final: fd 20

ws:[2023/12/05 07:51:57:0947] D: [wsi|1|listen|default|127.0.0.1|10350]: _lws_change_pollfd: fd 15 events 1 -> 1

ws:[2023/12/05 07:51:57:0947] D: [wsisrv|0|adopted]: __lws_vhost_unbind_wsi: vh default: count_bound_wsi 1

ws:[2023/12/05 07:51:57:0947] D: [wsisrv|0|adopted]: __lws_free_wsi: tsi fds count 3

ws:[2023/12/05 07:51:57:0947] N: __lws_lc_untag:  -- [wsisrv|0|adopted] (0) 209.261ms
```

**Comment by lws-team** [comment]
You can do `lws_close_reason(wsi, LWS_CLOSE_STATUS_NORMAL, "normal", 6);` or similar before closing it to control what lws will report if possible.

1006 doesn't mean any error, just the connection closed without telling a close reason (as it is allowed to).

**Comment by duguhaotian** [comment]
> You can do `lws_close_reason(wsi, LWS_CLOSE_STATUS_NORMAL, "normal", 6);` or similar before closing it to control what lws will report if possible.
> 
> 1006 doesn't mean any error, just the connection closed without telling a close reason (as it is allowed to).

i add at it at LWS_CALLBACK_CLOSED, but do not working
```
case LWS_CALLBACK_CLOSED: {
                unsigned char buf[8] = "normal";
                lws_close_reason(wsi, LWS_CLOSE_STATUS_NORMAL, buf, 6);
            }
            break;
```
ws logs: 
```
ws:[2023/12/05 08:16:00:5547] D: [wsisrv|0|adopted]: lws_service_fd_tsi: Close and handled

ws:[2023/12/05 08:16:00:5547] I: [wsisrv|0|adopted]: __lws_close_free_wsi: caller: close_and_handled

ws:[2023/12/05 08:16:00:5548] D: [wsisrv|0|adopted]: __lws_close_free_wsi: real just_kill_connection A: (sockfd 20)

ws:[2023/12/05 08:16:00:5548] I: __lws_close_free_wsi: shutdown conn: [wsisrv|0|adopted] (sk 20, state 0x119)

ws:[2023/12/05 08:16:00:5548] I: [wsisrv|0|adopted]: __lws_close_free_wsi: real just_kill_connection: sockfd 20

ws:[2023/12/05 08:16:00:5548] D: [wsi|1|listen|default|127.0.0.1|10350]: _lws_change_pollfd: fd 15 events 1 -> 1

ws:[2023/12/05 08:16:00:5548] D: [wsisrv|0|adopted]: lwsi_set_state: lwsi_set_state 0x20000119 -> 0x20000020

ws:[2023/12/05 08:16:00:5548] I: [wsisrv|0|adopted]: __lws_close_free_wsi: cce=1

ws:[2023/12/05 08:16:00:5549] D: [wsisrv|0|adopted]: __lws_close_free_wsi_final: fd 20

ws:[2023/12/05 08:16:00:5549] D: [wsi|1|listen|default|127.0.0.1|10350]: _lws_change_pollfd: fd 15 events 1 -> 1

ws:[2023/12/05 08:16:00:5549] D: [wsisrv|0|adopted]: __lws_vhost_unbind_wsi: vh default: count_bound_wsi 1

ws:[2023/12/05 08:16:00:5550] D: [wsisrv|0|adopted]: __lws_free_wsi: tsi fds count 3

ws:[2023/12/05 08:16:00:5550] N: __lws_lc_untag:  -- [wsisrv|0|adopted] (0) 156.741ms
```

**Comment by lws-team** [comment]
No, the close has already happened by then.

If you are closing after writing, do it before exit from the writeable callback.

**Comment by duguhaotian** [comment]
> No, the close has already happened by then.
> 
> If you are closing after writing, do it before exit from the writeable callback.

i add it in LWS_CALLBACK_SERVER_WRITEABLE, if flags is setted to closed.
it is working, but become to another error.....
```
crictl -D exec -w -it b277916602c7 date
DEBU[0000] get runtime connection
DEBU[0000] ExecRequest: &ExecRequest{ContainerId:b277916602c7,Cmd:[date],Tty:true,Stdin:true,Stdout:true,Stderr:false,}
DEBU[0000] ExecResponse: &ExecResponse{Url:http://localhost:10350/cri/exec/Mjg3MGY0OGRkNzY4YWYzNDMyYjIyNDE1NWZmMjA2YjFmYTBkMjA5MjMxMjY4MDE3,}
DEBU[0000] Exec URL: http://localhost:10350/cri/exec/Mjg3MGY0OGRkNzY4YWYzNDMyYjIyNDE1NWZmMjA2YjFmYTBkMjA5MjMxMjY4MDE3
DEBU[0000] StreamOptions: {0xc000136000 0xc000136008 0xc000136010 true <nil>}
Tue Dec  5 13:25:01 UTC 2023
FATA[0000] execing command in container: error stream protocol error: unknown error
```

ws logs
```
ws:[2023/12/05 08:28:15:6217] D: sending close packet

ws:[2023/12/05 08:28:15:6217] D:

ws:[2023/12/05 08:28:15:6217] D: 0000: 03 E8 6E 6F 72 6D 61 6C                            ..normal

ws:[2023/12/05 08:28:15:6217] D:

ws:[2023/12/05 08:28:15:6217] I: [wsisrv|1|adopted]: lws_issue_raw: ssl_capable_write (10) says 10

ws:[2023/12/05 08:28:15:6217] D: [wsisrv|1|adopted]: lwsi_set_state: lwsi_set_state 0x2000011b -> 0x2000011d

ws:[2023/12/05 08:28:15:6217] D: [wsisrv|1|adopted]: __lws_set_timeout: 5 secs, reason 6

ws:[2023/12/05 08:28:15:6217] D: sent close, await ack

ws:[2023/12/05 08:28:15:6217] D: [wsisrv|1|adopted]: _lws_change_pollfd: fd 20 events 5 -> 1

ws:[2023/12/05 08:28:15:6217] D: [wsisrv|1|adopted]: lws_handle_POLLOUT_event: non mux: wsistate 0x2000011d, ops ws

ws:[2023/12/05 08:28:15:6217] D: [wsisrv|1|adopted]: lws_service_fd_tsi: Close and handled

ws:[2023/12/05 08:28:15:6218] I: [wsisrv|1|adopted]: __lws_close_free_wsi: caller: close_and_handled

ws:[2023/12/05 08:28:15:6218] D: [wsisrv|1|adopted]: __lws_close_free_wsi: real just_kill_connection A: (sockfd 20)

ws:[2023/12/05 08:28:15:6218] I: __lws_close_free_wsi: shutdown conn: [wsisrv|1|adopted] (sk 20, state 0x11d)

ws:[2023/12/05 08:28:15:6218] I: [wsisrv|1|adopted]: __lws_close_free_wsi: real just_kill_connection: sockfd 20

ws:[2023/12/05 08:28:15:6218] D: [wsi|1|listen|default|127.0.0.1|10350]: _lws_change_pollfd: fd 15 events 1 -> 1

ws:[2023/12/05 08:28:15:6218] D: [wsisrv|1|adopted]: lwsi_set_state: lwsi_set_state 0x2000011d -> 0x20000020

ws:[2023/12/05 08:28:15:6218] I: [wsisrv|1|adopted]: __lws_close_free_wsi: cce=1

ws:[2023/12/05 08:28:15:6219] D: [wsisrv|1|adopted]: __lws_close_free_wsi_final: fd 20

ws:[2023/12/05 08:28:15:6219] D: [wsi|1|listen|default|127.0.0.1|10350]: _lws_change_pollfd: fd 15 events 1 -> 1

ws:[2023/12/05 08:28:15:6220] D: [wsisrv|1|adopted]: __lws_vhost_unbind_wsi: vh default: count_bound_wsi 1

ws:[2023/12/05 08:28:15:6220] D: [wsisrv|1|adopted]: __lws_free_wsi: tsi fds count 3

ws:[2023/12/05 08:28:15:6220] N: __lws_lc_untag:  -- [wsisrv|1|adopted] (0) 167.089ms
```

**Comment by duguhaotian** [comment]
the new error i think is my bug...
thank your very much
