### ISSUE TITLE
minimal_pmd_bulk missing ext in answer

### ISSUE THREAD

**Issue by LadMartin** [warmcat/libwebsockets#1823]
Hi, I have tried the example and I failed to see the compression.
When I took a look to wireshark

```
Frame 4750: 634 bytes on wire (5072 bits), 634 bytes captured (5072 bits) on interface lo, id 0
Ethernet II, Src: 00:00:00_00:00:00 (00:00:00:00:00:00), Dst: 00:00:00_00:00:00 (00:00:00:00:00:00)
Internet Protocol Version 4, Src: 127.0.0.1, Dst: 127.0.0.1
Transmission Control Protocol, Src Port: 46666, Dst Port: 7681, Seq: 1, Ack: 1, Len: 568
    Source Port: 46666
    Destination Port: 7681
    [Stream index: 217]
    [TCP Segment Len: 568]
    Sequence number: 1    (relative sequence number)
    Sequence number (raw): 2627707642
    [Next sequence number: 569    (relative sequence number)]
    Acknowledgment number: 1    (relative ack number)
    Acknowledgment number (raw): 639436660
    1000 .... = Header Length: 32 bytes (8)
    Flags: 0x018 (PSH, ACK)
    Window size value: 512
    [Calculated window size: 65536]
    [Window size scaling factor: 128]
    Checksum: 0x0061 [unverified]
    [Checksum Status: Unverified]
    Urgent pointer: 0
    Options: (12 bytes), No-Operation (NOP), No-Operation (NOP), Timestamps
    [SEQ/ACK analysis]
    [Timestamps]
    TCP payload (568 bytes)
Hypertext Transfer Protocol
    GET / HTTP/1.1\r\n
        [Expert Info (Chat/Sequence): GET / HTTP/1.1\r\n]
        Request Method: GET
        Request URI: /
        Request Version: HTTP/1.1
    Host: localhost:7681\r\n
    Connection: Upgrade\r\n
    Pragma: no-cache\r\n
    Cache-Control: no-cache\r\n
    User-Agent: Mozilla/5.0 (X11; Fedora; Linux x86_64) AppleWebKit/537.36 (KHTML, like Gecko) Chrome/79.0.3945.88 Safari/537.36\r\n
    Upgrade: websocket\r\n
    Origin: http://localhost:7681\r\n
    Sec-WebSocket-Version: 13\r\n
    Accept-Encoding: gzip, deflate, br\r\n
    Accept-Language: cs,en-US;q=0.9,en;q=0.8,en-GB;q=0.7,de;q=0.6\r\n
    Sec-WebSocket-Key: J28UNUI2WwMN++AwnsPiEA==\r\n
    Sec-WebSocket-Extensions: permessage-deflate; client_max_window_bits\r\n
    Sec-WebSocket-Protocol: lws-minimal-pmd-bulk\r\n
    \r\n
    [Full request URI: http://localhost:7681/]
    [HTTP request 1/1]
    [Response in frame: 4752]
```

And then there is the response

```
Frame 4752: 241 bytes on wire (1928 bits), 241 bytes captured (1928 bits) on interface lo, id 0
Ethernet II, Src: 00:00:00_00:00:00 (00:00:00:00:00:00), Dst: 00:00:00_00:00:00 (00:00:00:00:00:00)
Internet Protocol Version 4, Src: 127.0.0.1, Dst: 127.0.0.1
Transmission Control Protocol, Src Port: 7681, Dst Port: 46666, Seq: 1, Ack: 569, Len: 175
    Source Port: 7681
    Destination Port: 46666
    [Stream index: 217]
    [TCP Segment Len: 175]
    Sequence number: 1    (relative sequence number)
    Sequence number (raw): 639436660
    [Next sequence number: 176    (relative sequence number)]
    Acknowledgment number: 569    (relative ack number)
    Acknowledgment number (raw): 2627708210
    1000 .... = Header Length: 32 bytes (8)
    Flags: 0x018 (PSH, ACK)
    Window size value: 512
    [Calculated window size: 65536]
    [Window size scaling factor: 128]
    Checksum: 0xfed7 [unverified]
    [Checksum Status: Unverified]
    Urgent pointer: 0
    Options: (12 bytes), No-Operation (NOP), No-Operation (NOP), Timestamps
    [SEQ/ACK analysis]
    [Timestamps]
    TCP payload (175 bytes)
Hypertext Transfer Protocol
    HTTP/1.1 101 Switching Protocols\r\n
        [Expert Info (Chat/Sequence): HTTP/1.1 101 Switching Protocols\r\n]
        Response Version: HTTP/1.1
        Status Code: 101
        [Status Code Description: Switching Protocols]
        Response Phrase: Switching Protocols
    Upgrade: WebSocket\r\n
    Connection: Upgrade\r\n
    Sec-WebSocket-Accept: bOLjEb0s65tKGcQvBCRpQJTdu3M=\r\n
    Sec-WebSocket-Protocol: lws-minimal-pmd-bulk\r\n
    \r\n
    [HTTP response 1/1]
    [Time since request: 0.000150090 seconds]
    [Request in frame: 4750]
    [Request URI: http://localhost:7681/]
```

And In the response from the server, I am missing the Sec-WebSocket-Extensions: permessage-deflate

Because then in the data, I see the clear text and no compression.

So the question is, do I miss something or how do I turn the compression on?

Thank you

**Comment by lws-team** [comment]
You need to enable it at cmake with -DLWS_WITHOUT_EXTENSIONS=0

**Comment by LadMartin** [comment]
Thanks, that worked :)On Jan 10, 2020 17:44, Andy Green <notifications@github.com> wrote:You need to enable it at cmake with -DLWS_WITHOUT_EXTENSIONS=0
