### ISSUE TITLE
WebSocket connections fail in libwebsockets 4.4.0,  libwebsockets-3.2 is  ok.

### ISSUE THREAD

**Issue by 506124204** [warmcat/libwebsockets#3505]
// client: 1006 CLOSE_ABNORMAL
// on windows
// server  no  response：   HTTP/1.1 101 Switching Protocols

///////////////////////////////////////////
// server 
#include <libwebsockets.h>
#include <string>
#include <iostream>
#include <map>
#include <stdlib.h>
#include <signal.h>

// --- Configuration ---
#define SERVER_PORT 7681
#define PROTOCOL_NAME "device-hub-rpc"

#define MAX_PAYLOAD 1024

static int interrupt_requested = 0;

struct per_session_data {
    unsigned int id;
    unsigned char buffer[LWS_PRE + MAX_PAYLOAD];
    size_t len;
    int last_message_time;
    struct lws* wsi;
};

struct server_context {
    struct lws_context* lws_context;
    unsigned int next_id;
};

static int ws_send_message(struct lws* wsi, const char* message, size_t len)
{
    unsigned char buffer[LWS_PRE + MAX_PAYLOAD];
    size_t send_len = len > MAX_PAYLOAD ? MAX_PAYLOAD : len;

    memcpy(buffer + LWS_PRE, message, send_len);

    return lws_write(wsi, buffer + LWS_PRE, send_len, LWS_WRITE_TEXT);
}

static void sigint_handler(int sig)
{
    interrupt_requested = 1;
}
static int callback_ws(struct lws* wsi, enum lws_callback_reasons reason,
    void* user, void* in, size_t len)
{
    struct per_session_data* pss = (struct per_session_data*)user;
    struct server_context* context = (struct server_context*)
        lws_context_user(lws_get_context(wsi));

    switch (reason) {
    case LWS_CALLBACK_ESTABLISHED:
        pss->id = context->next_id++;
        pss->wsi = wsi;
        printf("WebSocketLWS_CALLBACK_ESTABLISHED，ID: %u\n", pss->id);

        ws_send_message(wsi, "LWS_CALLBACK_ESTABLISHED!", strlen("LWS_CALLBACK_ESTABLISHED!"));
        break;

    case LWS_CALLBACK_RECEIVE: 
        printf("LWS_CALLBACK_RECEIVE %u,%.*s\n", pss->id, (int)len, (char*)in);
         
        char response[MAX_PAYLOAD];
        snprintf(response, MAX_PAYLOAD, "LWS_CALLBACK_RECEIVE: %.*s", (int)len, (char*)in);
        ws_send_message(wsi, response, strlen(response));
        break;

    case LWS_CALLBACK_CLOSED: 
        printf("WebSocketLWS_CALLBACK_CLOSED: %u\n", pss->id);
        break;

    default:
        break;
    }

    return 0;
}
 
static const struct lws_protocols protocols[] = {
    {
        PROTOCOL_NAME,
        callback_ws,     
        sizeof(struct per_session_data),  
        MAX_PAYLOAD,            
    },
    { NULL, NULL, 0, 0 }   
};
 
int main(int argc, char** argv)
{  
    struct lws_context_creation_info info;
    struct server_context context;
    int port = SERVER_PORT; 
    printf("WebSocket staring %d...\n", port);
     
    signal(SIGINT, sigint_handler);
     
    memset(&context, 0, sizeof(context));
    context.next_id = 1;
     
    memset(&info, 0, sizeof(info));
    info.port = port;
    info.protocols = protocols;
    info.gid = -1;
    info.uid = -1;
    info.user = &context;
    info.options = 0;

    context.lws_context = lws_create_context(&info);
    if (!context.lws_context) {
        fprintf(stderr, "lws_create_context\n");
        return -1;
    } 
     
    while (!interrupt_requested) {
        lws_service(context.lws_context, 50);
    }
     
    lws_context_destroy(context.lws_context);
    printf("lws_context_destroy\n");

    return 0;
}

**Comment by lws-team** [comment]
What happens with main / v4.4-stable?

**Comment by 506124204** [comment]
> What happens with main / v4.4-stable?
yes

**Comment by 506124204** [comment]
libwebsocket: main / v4.4-stable
web client：  https://livepersoninc.github.io/ws-test-page/
 
1.  html:   let websocket = new WebSocket('ws://localhost:7681', ["example-protocol"]);   // This way is okay.   Connected and data sending.
2.  html:   let websocket = new WebSocket('ws://localhost:7681');   // connect  failed!!!!???????
   **I don't know where the problem lies in the server-side code ?**


129	4.607894	127.0.0.1	127.0.0.1	TCP	52	51445 → 7681 [PSH, ACK] Seq=1 Ack=1 Win=10233 Len=8
130	4.607944	127.0.0.1	127.0.0.1	TCP	44	7681 → 51445 [ACK] Seq=1 Ack=9 Win=10233 Len=0
131	4.608039	127.0.0.1	127.0.0.1	TCP	44	51445 → 7681 [FIN, ACK] Seq=9 Ack=1 Win=10233 Len=0
132	4.608060	127.0.0.1	127.0.0.1	TCP	44	7681 → 51445 [ACK] Seq=1 Ack=10 Win=10233 Len=0
133	4.608202	127.0.0.1	127.0.0.1	TCP	48	7681 → 51445 [PSH, ACK] Seq=1 Ack=10 Win=10233 Len=4
134	4.608236	127.0.0.1	127.0.0.1	TCP	44	51445 → 7681 [RST, ACK] Seq=10 Ack=5 Win=0 Len=0
135	4.610508	127.0.0.1	127.0.0.1	TCP	56	51734 → 7681 [SYN] Seq=0 Win=65535 Len=0 MSS=65495 WS=256 SACK_PERM
136	4.610576	127.0.0.1	127.0.0.1	TCP	56	7681 → 51734 [SYN, ACK] Seq=0 Ack=1 Win=65535 Len=0 MSS=65495 WS=256 SACK_PERM
137	4.610612	127.0.0.1	127.0.0.1	TCP	44	51734 → 7681 [ACK] Seq=1 Ack=1 Win=2619648 Len=0
**139	4.624620	127.0.0.1	127.0.0.1	HTTP	197	GET / HTTP/1.1** 
140	4.624666	127.0.0.1	127.0.0.1	TCP	44	7681 → 51734 [ACK] Seq=1 Ack=154 Win=2619648 Len=0
141	4.624720	127.0.0.1	127.0.0.1	TCP	171	7681 → 51734 [PSH, ACK] Seq=1 Ack=154 Win=2619648 Len=127
142	4.624742	127.0.0.1	127.0.0.1	TCP	44	51734 → 7681 [ACK] Seq=154 Ack=128 Win=2619648 Len=0

**Comment by 506124204** [comment]
1.minimal examples    ok。
2. One of my brothers had a similar problem in question No. #3487.
3.  protocols:  let websocket = new **WebSocket('ws://localhost:7681');**   

static const struct lws_protocols protocols[] = {
{
    "",      **//  It worked well in versions 3.2 and 4.3, but the client connection failed in version 4.4.**
    callback_lws_protocol,
    0,
    4096,
},
