### ISSUE TITLE
Can LWSMPRO_HTTPS proxy a ws server ?

### ISSUE THREAD

**Issue by zhiwenzheng** [warmcat/libwebsockets#1709]
Hi,

I have a ws server binding to localhost:6080, previously I used lighttpd to proxy URI "/iostat" to the server, use the following config:

> 
>$HTTP["url"] == "/iostat" {
    proxy.server = ( "" => ( ( "host" => "127.0.0.1", "port" => "6080" ) ) )
    proxy.header = ( "upgrade" => "enable" )
}

I want to ask does libwebsocket support this kind configuration?
I tried LWSMPRO_HTTPS using the following config:

```
static const struct lws_http_mount mount_iostat = {
	/* .mount_next */		NULL,		/* linked-list "next" */
	/* .mountpoint */		"/iostat",		/* mountpoint URL */
	/* .origin */			"localhost:6080", /* serve from dir */
	/* .def */			    NULL,	/* default filename */
	/* .protocol */			NULL,
	/* .cgienv */			NULL,
	/* .extra_mimetypes */		NULL,
	/* .interpret */		NULL,
	/* .cgi_timeout */		0,
	/* .cache_max_age */		0,
	/* .auth_mask */		0,
	/* .cache_reusable */		0,
	/* .cache_revalidate */		0,
	/* .cache_intermediaries */	0,
	/* .origin_protocol */		LWSMPRO_HTTPS,	/* files in a dir */
	/* .mountpoint_len */		7,		/* char count */
	/* .basic_auth_login_file */	NULL,
    {NULL, NULL}
};
```
And get the following error message:

>
> [2019/10/07 08:32:20:0550] I: Upgrade to ws
[2019/10/07 08:32:20:0561] D: checking nic
[2019/10/07 08:32:20:0561] N: No supported protocol "nic"

nic is one of my ws protocols.

**Comment by zhiwenzheng** [comment]
LWS_WITH_HTTP_PROXY not defined

**Comment by lws-team** [comment]
If you have LWS_WITH_HTTP_PROXY and LWS_ROLE_WS defined, it should proxy h1 ws just fine.

I'm not sure you want HTTPS in the mount if it's proxying locally, normally there's no tls on the inside service.  You independently add tls on the internet-facing vhost.

**Comment by lws-team** [comment]
I take it when you enabled the proxy at cmake, it worked.

**Comment by zhiwenzheng** [comment]
Sorry I was busy with something else.
This proxy still not work, I get the same error.
>
>[2019/10/07 16:15:36:2381] I: Upgrade to ws
[2019/10/07 16:15:36:2382] D: checking nic
[2019/10/07 16:15:36:2382] N: No supported protocol "nic"

I confirm LWS_WITH_HTTP_PROXY and LWS_ROLE_WS is defined now.
>
>nm /usr/lib/libwebsockets.so.15 |grep proxy
[203]	|     86875|      1531|FUNC |LOCL |2    |13     |lws_callback_ws_proxy
[90]	|    310244|      1485|FUNC |LOCL |2    |13     |lws_http_proxy_start
[1523]	|    203618|       562|FUNC |GLOB |0    |13     |lws_set_proxy
[47]	|    485008|        28|OBJT |LOCL |2    |24     |lws_ws_proxy
[344]	|     86418|       198|FUNC |LOCL |0    |13     |proxy_header
[547]	|    165458|        52|FUNC |LOCL |0    |13     |ws_destroy_proxy_buf

>
>[root@h55 /opt/istorOS/projects/local/flow/http]# nm /usr/lib/libwebsockets.so.15 |grep lws_process_ws_upgrade
[49]	|    175154|      1033|FUNC |LOCL |2    |13     |lws_process_ws_upgrade
[153]	|    174179|       975|FUNC |LOCL |2    |13     |lws_process_ws_upgrade2

**Comment by lws-team** [comment]
The ws flow should diverge here for the proxy case

https://libwebsockets.org/git/libwebsockets/tree/lib/roles/ws/server-ws.c#n448

you might want to stick some temporary lwsl_err() to find out where it's going.  It's difficult to tell if it follows the right path and then the subsequent logging is telling us about the proxy connection coming back in there and (correctly) not taking that path.

> there is only one vhost configured and is the internet facing vhost.

It's OK, what I meant was you should have that, and probably tls on it, but

`internet -- https -- [ tls + lws proxy ] -- http -- [ local service ]`

ie, no need for tls on the internal link between lws and the local service.

**Comment by zhiwenzheng** [comment]
First, mount_iostat was not linked in.
After linked, mount_iostat changed to
```
static const struct lws_http_mount mount_iostat = {
	/* .mount_next */		NULL,		/* linked-list "next" */
	/* .mountpoint */		"/iostat",		/* mountpoint URL */
	/* .origin */			"localhost:6080/", /* serve from dir */
	/* .def */			    NULL,	/* default filename */
	/* .protocol */			NULL,
	/* .cgienv */			NULL,
	/* .extra_mimetypes */		NULL,
	/* .interpret */		NULL,
	/* .cgi_timeout */		0,
	/* .cache_max_age */		0,
	/* .auth_mask */		0,
	/* .cache_reusable */		0,
	/* .cache_revalidate */		0,
	/* .cache_intermediaries */	0,
	/* .origin_protocol */		LWSMPRO_HTTP,	/* files in a dir */
	/* .mountpoint_len */		7,		/* char count */
	/* .basic_auth_login_file */	NULL,
    {NULL, NULL}
};
```
Now can connect to the ws server, but read failed:
>
>[2019/10/07 20:41:23:7820] I: Upgrade to ws
[2019/10/07 20:41:23:7821] E: lws_process_ws_upgrade: hit 8051760, meth 0, op 0
[2019/10/07 20:41:23:7821] E: lws_process_ws_upgrade: hit->origin_protocol 0
[2019/10/07 20:41:23:7821] N: lws_http_proxy_start: hit 8051760
[2019/10/07 20:41:23:7822] D: lws_ensure_user_space: 8144aa0 protocol pss 0, user_space=0
[2019/10/07 20:41:23:7822] E: hit->origin: localhost:6080/
[2019/10/07 20:41:23:7822] I: proxying to localhost port 6080 url /, ssl 0, from (null), to (null)
[2019/10/07 20:41:23:7822] D: _realloc: size 464: client wsi
[2019/10/07 20:41:23:7823] I: lws_vhost_bind_wsi: vh default: count_bound_wsi 8
[2019/10/07 20:41:23:7823] D: _realloc: size 212: client ws struct
[2019/10/07 20:41:23:7823] D: lws_role_transition: 813f118: wsistate 0x10000200, ops h1
[2019/10/07 20:41:23:7824] I: lws_client_connect_via_info: role binding to h1
[2019/10/07 20:41:23:7824] I: lws_client_connect_via_info: protocol binding to lws-ws-proxy
[2019/10/07 20:41:23:7824] D: lws_ensure_user_space: 813f118 protocol pss 0, user_space=0
[2019/10/07 20:41:23:7824] D: _realloc: size 36: client stash
[2019/10/07 20:41:23:7825] D: _realloc: size 10: strdup
[2019/10/07 20:41:23:7825] D: _realloc: size 2: strdup
[2019/10/07 20:41:23:7825] D: _realloc: size 10: strdup
[2019/10/07 20:41:23:7826] D: _realloc: size 4: strdup
[2019/10/07 20:41:23:7826] D: _realloc: size 9: strdup
[2019/10/07 20:41:23:7826] I: lws_client_connect_via_info: created child 813f118 of parent 8144aa0
[2019/10/07 20:41:23:7826] I: lws_header_table_attach: wsi 813f118: ah 0 (tsi 0, count = 2) in
[2019/10/07 20:41:23:7827] D: _realloc: size 952: ah struct
[2019/10/07 20:41:23:7827] D: _realloc: size 4096: ah data
[2019/10/07 20:41:23:7827] I: _lws_create_ah: created ah 81572e8 (size 4096): pool length 3
[2019/10/07 20:41:23:7827] I: lws_header_table_attach: did attach wsi 813f118: ah 81572e8: count 3 (on exit)
[2019/10/07 20:41:23:7828] D: __lws_set_timeout: 813f118: 10 secs, reason 25
[2019/10/07 20:41:23:7828] D: lws_http_client_connect_via_info2: 813f118 (stash 813f2f0)
[2019/10/07 20:41:23:7828] D: _realloc: size 10: strdup
[2019/10/07 20:41:23:7829] I: lws_client_connect_2: 813f118: address localhost:6080
[2019/10/07 20:41:23:7938] D: lwsi_set_state(813f118, 0x10000201)
[2019/10/07 20:41:23:7939] D: __insert_wsi_socket_into_fds: 813f118: tsi=0, sock=11, pos-in-fds=7
[2019/10/07 20:41:23:7939] D: _lws_change_pollfd: wsi 813f118: fd 11 events 1 -> 1
[2019/10/07 20:41:23:7939] D: __lws_set_timeout: 813f118: 20 secs, reason 2
[2019/10/07 20:41:23:7941] I: lws_client_connect_3: wsi 813f118: h1 lws-ws-proxy client created own conn (raw 0)
[2019/10/07 20:41:23:7941] D: lwsi_set_state(813f118, 0x10000011)
[2019/10/07 20:41:23:7941] D: __lws_set_timeout: 813f118: 20 secs, reason 8
[2019/10/07 20:41:23:7942] D: _lws_change_pollfd: wsi 813f118: fd 11 events 1 -> 1
[2019/10/07 20:41:23:7942] D: lwsi_set_state(813f118, 0x10000012)
[2019/10/07 20:41:23:7942] D: __lws_set_timeout: 813f118: 20 secs, reason 11
[2019/10/07 20:41:23:7943] D: proxy_header: index 22: en-US,en;q=0.9
[2019/10/07 20:41:23:7943] D: proxy_header: index 26: User=IPmLEg==.moAX39O/UbYy7Qv6Jrw1Ag==.V1BmOxl5YxcRICXMfaTduw==
[2019/10/07 20:41:23:7943] D: proxy_header: no index 66:
[2019/10/07 20:41:23:7944] I: lws_client_socket_service: HANDSHAKE2: 813f118: sending headers on 813f118 (wsistate 0x10000012 0x10000012), w sock 11, wsi sock 11
[2019/10/07 20:41:23:7944] D: lwsi_set_state(813f118, 0x1000020a)
[2019/10/07 20:41:23:7944] D: __lws_set_timeout: 813f118: 20 secs, reason 4
[2019/10/07 20:41:23:7945] D: _lws_change_pollfd: wsi 813f118: fd 11 events 1 -> 5
[2019/10/07 20:41:23:7945] D: lwsi_set_state(813f118, 0x1000020a)
[2019/10/07 20:41:23:7945] D: __lws_set_timeout: 813f118: 20 secs, reason 4
[2019/10/07 20:41:23:7945] D: lws_client_connect_via_info: wsi 813f118: cb 19 to h1 lws-ws-proxy
[2019/10/07 20:41:23:7946] I: lws_http_proxy_start: setting proxy clientside on 813f118 (parent 8144aa0)
[2019/10/07 20:41:23:7946] D: lws_http_proxy_start: (requesting 'nic')
[2019/10/07 20:41:23:7946] D: lws_h1_server_socket_service: consumed 578
[2019/10/07 20:41:23:7947] D: _lws_change_pollfd: wsi 813f118: fd 11 events 5 -> 1
[2019/10/07 20:41:23:8070] I: closing conn at LWS_CONNMODE...SERVER_REPLY
[2019/10/07 20:41:23:8071] I: reason: read failed

**Comment by lws-team** [comment]
> [2019/10/07 20:41:23:8071] I: reason: read failed

I think it just means the far side hung up on it.  It's probably a good idea to do, eg, `tcpdump -i lo port 6080 -s0 -X` and see what happens between lws and the local service... it's not encrypted so you should be able to see it.

lws doesn't proxy every incoming header, it just cherrypicks some common ones including those needed for ws handshake.  That part looks like it's OK in the logs... the remote peer -> lws bit terminates into "lws-ws-proxy" local protocol and similarly the onward client connection is bound to "lws-ws-proxy" and then connects to the other service with "nic" protocol.  But if you have some funny headers, the other service may get upset seeing the proxy has stripped them.

**Comment by zhiwenzheng** [comment]
tcpdump cannot capture loopback on solaris seemingly.

This is the output of snoop.
> 
>snoop -I lo0 -x 0 port 6080
Using device ipnet/lo0 (promiscuous mode)
   localhost -> localhost    TCP D=6080 S=61838 Syn Seq=3468710609 Len=0 Win=32768 Options=<mss 8192,sackOK,tstamp 4591313 0,nop,wscale 5>

           0: 011a 0002 0000 0050 0000 0001 0000 0000    .......P........
          16: 0000 0000 0000 0000 6000 0000 0028 063c    ........`....(.<
          32: 0000 0000 0000 0000 0000 0000 0000 0001    ................
          48: 0000 0000 0000 0000 0000 0000 0000 0001    ................
          64: f18e 17c0 cec0 52d1 0000 0000 a002 8000    ......R.........
          80: 0028 0000 0204 2000 0402 080a 0046 0ed1    .(.... ......F..
          96: 0000 0000 0103 0305                        ........

   localhost -> localhost    TCP D=61838 S=6080 Syn Ack=3468710610 Seq=2301218493 Len=0 Win=32975 Options=<sackOK,tstamp 4591313 4591313,mss 8192,nop,wscale 5>

           0: 011a 0002 0000 0050 0000 0001 0000 0000    .......P........
          16: 0000 0000 0000 0000 6000 0000 0028 063c    ........`....(.<
          32: 0000 0000 0000 0000 0000 0000 0000 0001    ................
          48: 0000 0000 0000 0000 0000 0000 0000 0001    ................
          64: 17c0 f18e 8929 cebd cec0 52d2 a012 80cf    .....)....R.....
          80: 0028 0000 0402 080a 0046 0ed1 0046 0ed1    .(.......F...F..
          96: 0204 2000 0103 0305                        .. .....

   localhost -> localhost    TCP D=6080 S=61838 Ack=2301218494 Seq=3468710610 Len=0 Win=32975 Options=<nop,nop,tstamp 4591313 4591313>

           0: 011a 0002 0000 0048 0000 0001 0000 0000    .......H........
          16: 0000 0000 0000 0000 6000 0000 0020 063c    ........`.... .<
          32: 0000 0000 0000 0000 0000 0000 0000 0001    ................
          48: 0000 0000 0000 0000 0000 0000 0000 0001    ................
          64: f18e 17c0 cec0 52d2 8929 cebe 8010 80cf    ......R..)......
          80: 0020 0000 0101 080a 0046 0ed1 0046 0ed1    . .......F...F..

   localhost -> localhost    TCP D=6080 S=61838 Push Ack=2301218494 Seq=3468710610 Len=326 Win=32768 Options=<nop,nop,tstamp 4591315 4591313>

           0: 011a 0002 0000 018e 0000 0001 0000 0000    ................
          16: 0000 0000 0000 0000 6000 0000 0166 063c    ........`....f.<
          32: 0000 0000 0000 0000 0000 0000 0000 0001    ................
          48: 0000 0000 0000 0000 0000 0000 0000 0001    ................
          64: f18e 17c0 cec0 52d2 8929 cebe 8018 8000    ......R..)......
          80: 0166 0000 0101 080a 0046 0ed3 0046 0ed1    .f.......F...F..
          96: 4745 5420 2f20 4854 5450 2f31 2e31 0d0a    GET / HTTP/1.1..
         112: 5072 6167 6d61 3a20 6e6f 2d63 6163 6865    Pragma: no-cache
         128: 0d0a 4361 6368 652d 436f 6e74 726f 6c3a    ..Cache-Control:
         144: 206e 6f2d 6361 6368 650d 0a48 6f73 743a     no-cache..Host:
         160: 2068 3535 3a38 313a 3831 0d0a 5570 6772     h55:81:81..Upgr
         176: 6164 653a 2077 6562 736f 636b 6574 0d0a    ade: websocket..
         192: 436f 6e6e 6563 7469 6f6e 3a20 5570 6772    Connection: Upgr
         208: 6164 650d 0a53 6563 2d57 6562 536f 636b    ade..Sec-WebSock
         224: 6574 2d4b 6579 3a20 7832 6b72 3254 706a    et-Key: x2kr2Tpj
         240: 5847 6742 5746 4439 5161 7455 7277 3d3d    XGgBWFD9QatUrw==
         256: 0d0a 5365 632d 5765 6253 6f63 6b65 742d    ..Sec-WebSocket-
         272: 5072 6f74 6f63 6f6c 3a20 6e69 630d 0a53    Protocol: nic..S
         288: 6563 2d57 6562 536f 636b 6574 2d56 6572    ec-WebSocket-Ver
         304: 7369 6f6e 3a20 3133 0d0a 6163 6365 7074    sion: 13..accept
         320: 2d6c 616e 6775 6167 653a 2065 6e2d 5553    -language: en-US
         336: 2c65 6e3b 713d 302e 390d 0a63 6f6f 6b69    ,en;q=0.9..cooki
         352: 653a 2055 7365 723d 4950 6d4c 4567 3d3d    e: User=IPmLEg==
         368: 2e6d 6f41 5833 394f 2f55 6259 7937 5176    .moAX39O/UbYy7Qv
         384: 364a 7277 3141 673d 3d2e 5631 426d 4f78    6Jrw1Ag==.V1BmOx
         400: 6c35 5978 6352 4943 584d 6661 5464 7577    l5YxcRICXMfaTduw
         416: 3d3d 0d0a 0d0a                             ==....

   localhost -> localhost    TCP D=61838 S=6080 Fin Ack=3468710936 Seq=2301218494 Len=0 Win=32975 Options=<nop,nop,tstamp 4591328 4591313>

           0: 011a 0002 0000 0048 0000 0001 0000 0000    .......H........
          16: 0000 0000 0000 0000 6000 0000 0020 063c    ........`.... .<
          32: 0000 0000 0000 0000 0000 0000 0000 0001    ................
          48: 0000 0000 0000 0000 0000 0000 0000 0001    ................
          64: 17c0 f18e 8929 cebe cec0 5418 8011 80cf    .....)....T.....
          80: 0020 0000 0101 080a 0046 0ee0 0046 0ed1    . .......F...F..

   localhost -> localhost    TCP D=6080 S=61838 Ack=2301218495 Seq=3468710936 Len=0 Win=32768 Options=<nop,nop,tstamp 4591328 4591328>

           0: 011a 0002 0000 0048 0000 0001 0000 0000    .......H........
          16: 0000 0000 0000 0000 6000 0000 0020 063c    ........`.... .<
          32: 0000 0000 0000 0000 0000 0000 0000 0001    ................
          48: 0000 0000 0000 0000 0000 0000 0000 0001    ................
          64: f18e 17c0 cec0 5418 8929 cebf 8010 8000    ......T..)......
          80: 0020 0000 0101 080a 0046 0ee0 0046 0ee0    . .......F...F..

   localhost -> localhost    TCP D=6080 S=61838 Fin Ack=2301218495 Seq=3468710936 Len=0 Win=32768 Options=<nop,nop,tstamp 4591329 4591328>

           0: 011a 0002 0000 0048 0000 0001 0000 0000    .......H........
          16: 0000 0000 0000 0000 6000 0000 0020 063c    ........`.... .<
          32: 0000 0000 0000 0000 0000 0000 0000 0001    ................
          48: 0000 0000 0000 0000 0000 0000 0000 0001    ................
          64: f18e 17c0 cec0 5418 8929 cebf 8011 8000    ......T..)......
          80: 0020 0000 0101 080a 0046 0ee1 0046 0ee0    . .......F...F..

   localhost -> localhost    TCP D=61838 S=6080 Ack=3468710937 Seq=2301218495 Len=0 Win=32975 Options=<nop,nop,tstamp 4591329 4591329>

           0: 011a 0002 0000 0048 0000 0001 0000 0000    .......H........
          16: 0000 0000 0000 0000 6000 0000 0020 063c    ........`.... .<
          32: 0000 0000 0000 0000 0000 0000 0000 0001    ................
          48: 0000 0000 0000 0000 0000 0000 0000 0001    ................
          64: 17c0 f18e 8929 cebf cec0 5419 8010 80cf    .....)....T.....
          80: 0020 0000 0101 080a 0046 0ee1 0046 0ee1    . .......F...F..

**Comment by zhiwenzheng** [comment]
following is the lighttpd session.
>
> snoop -I lo0 -x 0 port 6080
Using device ipnet/lo0 (promiscuous mode)
   localhost -> localhost    TCP D=6080 S=37200 Syn Seq=4233629146 Len=0 Win=32768 Options=<mss 8192,sackOK,tstamp 27030646 0,nop,wscale 5>

           0: 0102 0002 0000 003c 0000 0001 0000 0000    .......<........
          16: 0000 0000 0000 0000 4500 003c 0000 4000    ........E..<..@.
          32: 4006 0000 7f00 0001 7f00 0001 9150 17c0    @............P..
          48: fc58 0dda 0000 0000 a002 8000 0028 0000    .X...........(..
          64: 0204 2000 0402 080a 019c 7476 0000 0000    .. .......tv....
          80: 0103 0305                                  ....

   localhost -> localhost    TCP D=37200 S=6080 Syn Ack=4233629147 Seq=2859087798 Len=0 Win=32975 Options=<sackOK,tstamp 27030647 27030646,mss 8192,nop,wscale 5>

           0: 0102 0002 0000 003c 0000 0001 0000 0000    .......<........
          16: 0000 0000 0000 0000 4500 003c 0000 4000    ........E..<..@.
          32: 3c06 0000 7f00 0001 7f00 0001 17c0 9150    <..............P
          48: aa6a 37b6 fc58 0ddb a012 80cf 0028 0000    .j7..X.......(..
          64: 0402 080a 019c 7477 019c 7476 0204 2000    ......tw..tv.. .
          80: 0103 0305                                  ....

   localhost -> localhost    TCP D=6080 S=37200 Ack=2859087799 Seq=4233629147 Len=0 Win=32975 Options=<nop,nop,tstamp 27030647 27030647>

           0: 0102 0002 0000 0034 0000 0001 0000 0000    .......4........
          16: 0000 0000 0000 0000 4500 0034 0000 4000    ........E..4..@.
          32: 4006 0000 7f00 0001 7f00 0001 9150 17c0    @............P..
          48: fc58 0ddb aa6a 37b7 8010 80cf 0020 0000    .X...j7...... ..
          64: 0101 080a 019c 7477 019c 7477              ......tw..tw

   localhost -> localhost    TCP D=6080 S=37200 Push Ack=2859087799 Seq=4233629147 Len=910 Win=32768 Options=<nop,nop,tstamp 27030647 27030647>

           0: 0102 0002 0000 03c2 0000 0001 0000 0000    ................
          16: 0000 0000 0000 0000 4500 03c2 0000 4000    ........E.....@.
          32: 4006 0000 7f00 0001 7f00 0001 9150 17c0    @............P..
          48: fc58 0ddb aa6a 37b7 8018 8000 03ae 0000    .X...j7.........
          64: 0101 080a 019c 7477 019c 7477 4745 5420    ......tw..twGET 
          80: 2f69 6f73 7461 7420 4854 5450 2f31 2e31    /iostat HTTP/1.1
          96: 0d0a 486f 7374 3a20 6435 3235 0d0a 5072    ..Host: d525..Pr
         112: 6167 6d61 3a20 6e6f 2d63 6163 6865 0d0a    agma: no-cache..
         128: 4361 6368 652d 436f 6e74 726f 6c3a 206e    Cache-Control: n
         144: 6f2d 6361 6368 650d 0a55 7365 722d 4167    o-cache..User-Ag
         160: 656e 743a 204d 6f7a 696c 6c61 2f35 2e30    ent: Mozilla/5.0
         176: 2028 5831 313b 204c 696e 7578 2078 3836     (X11; Linux x86
         192: 5f36 3429 2041 7070 6c65 5765 624b 6974    _64) AppleWebKit
         208: 2f35 3337 2e33 3620 284b 4854 4d4c 2c20    /537.36 (KHTML, 
         224: 6c69 6b65 2047 6563 6b6f 2920 4368 726f    like Gecko) Chro
         240: 6d65 2f37 362e 302e 3338 3039 2e31 3030    me/76.0.3809.100
         256: 2053 6166 6172 692f 3533 372e 3336 0d0a     Safari/537.36..
         272: 5570 6772 6164 653a 2077 6562 736f 636b    Upgrade: websock
         288: 6574 0d0a 4f72 6967 696e 3a20 6874 7470    et..Origin: http
         304: 733a 2f2f 6435 3235 0d0a 5365 632d 5765    s://d525..Sec-We
         320: 6253 6f63 6b65 742d 5665 7273 696f 6e3a    bSocket-Version:
         336: 2031 330d 0a41 6363 6570 742d 456e 636f     13..Accept-Enco
         352: 6469 6e67 3a20 677a 6970 2c20 6465 666c    ding: gzip, defl
         368: 6174 652c 2062 720d 0a41 6363 6570 742d    ate, br..Accept-
         384: 4c61 6e67 7561 6765 3a20 656e 2d55 532c    Language: en-US,
         400: 656e 3b71 3d30 2e39 0d0a 436f 6f6b 6965    en;q=0.9..Cookie
         416: 3a20 636f 6d70 6163 745f 6469 7370 6c61    : compact_displa
         432: 795f 7374 6174 653d 6661 6c73 653b 2073    y_state=false; s
         448: 6573 7369 6f6e 6964 3d32 6a35 3334 6d67    essionid=2j534mg
         464: 4366 454a 6f59 2b48 764b 4a33 5258 6751    CfEJoY+HvKJ3RXgQ
         480: 6f58 736e 4e75 5035 5632 3639 4664 3579    oXsnNuP5V269Fd5y
         496: 444a 5a51 3d3b 2070 7265 6673 7669 6577    DJZQ=; prefsview
         512: 7370 6c69 7474 6572 3d31 3935 3b20 666f    splitter=195; fo
         528: 6c64 6572 7669 6577 7370 6c69 7474 6572    lderviewsplitter
         544: 3d33 3030 3b20 726f 756e 6463 7562 655f    =300; roundcube_
         560: 7365 7373 6964 3d6c 6861 6f68 7033 376e    sessid=lhaohp37n
         576: 6976 7531 356e 3438 6171 3339 6276 6565    ivu15n48aq39bvee
         592: 703b 2072 6f75 6e64 6375 6265 5f73 6573    p; roundcube_ses
         608: 7361 7574 683d 4153 6639 7533 5343 3959    sauth=ASf9u3SC9Y
         624: 7a45 4a33 307a 574c 4a69 4176 6454 7766    zEJ30zWLJiAvdTwf
         640: 2d31 3536 3736 3730 3730 303b 2055 7365    -1567670700; Use
         656: 723d 6261 756d 7767 3d3d 2e67 4a41 5033    r=baumwg==.gJAP3
         672: 637a 4a49 6a52 5055 6b34 4978 7664 3065    czJIjRPUk4Ixvd0e
         688: 773d 3d2e 6649 594b 394d 5847 394c 7249    w==.fIYK9MXG9LrI
         704: 5946 4c74 5232 756a 5277 3d3d 0d0a 5365    YFLtR2ujRw==..Se
         720: 632d 5765 6253 6f63 6b65 742d 4b65 793a    c-WebSocket-Key:
         736: 204e 7132 3070 367a 7371 6f2b 4562 4d44     Nq20p6zsqo+EbMD
         752: 6e42 5a4d 4d57 513d 3d0d 0a53 6563 2d57    nBZMMWQ==..Sec-W
         768: 6562 536f 636b 6574 2d45 7874 656e 7369    ebSocket-Extensi
         784: 6f6e 733a 2070 6572 6d65 7373 6167 652d    ons: permessage-
         800: 6465 666c 6174 653b 2063 6c69 656e 745f    deflate; client_
         816: 6d61 785f 7769 6e64 6f77 5f62 6974 730d    max_window_bits.
         832: 0a53 6563 2d57 6562 536f 636b 6574 2d50    .Sec-WebSocket-P
         848: 726f 746f 636f 6c3a 206e 6963 0d0a 582d    rotocol: nic..X-
         864: 466f 7277 6172 6465 642d 466f 723a 2031    Forwarded-For: 1
         880: 3932 2e31 3638 2e31 2e39 0d0a 582d 486f    92.168.1.9..X-Ho
         896: 7374 3a20 6435 3235 0d0a 582d 466f 7277    st: d525..X-Forw
         912: 6172 6465 642d 486f 7374 3a20 6435 3235    arded-Host: d525
         928: 0d0a 582d 466f 7277 6172 6465 642d 5072    ..X-Forwarded-Pr
         944: 6f74 6f3a 2068 7474 7073 0d0a 436f 6e6e    oto: https..Conn
         960: 6563 7469 6f6e 3a20 636c 6f73 652c 2075    ection: close, u
         976: 7067 7261 6465 0d0a 0d0a                   pgrade....

   localhost -> localhost    TCP D=37200 S=6080 Push Ack=4233629147 Seq=2859087799 Len=158 Win=32975 Options=<nop,nop,tstamp 27030647 27030647>

           0: 0102 0002 0000 00d2 0000 0001 0000 0000    ................
          16: 0000 0000 0000 0000 4500 00d2 0000 4000    ........E.....@.
          32: 3c06 0000 7f00 0001 7f00 0001 17c0 9150    <..............P
          48: aa6a 37b7 fc58 0ddb 8018 80cf 00be 0000    .j7..X..........
          64: 0101 080a 019c 7477 019c 7477 4854 5450    ......tw..twHTTP
          80: 2f31 2e31 2031 3031 2053 7769 7463 6869    /1.1 101 Switchi
          96: 6e67 2050 726f 746f 636f 6c73 0d0a 5570    ng Protocols..Up
         112: 6772 6164 653a 2057 6562 536f 636b 6574    grade: WebSocket
         128: 0d0a 436f 6e6e 6563 7469 6f6e 3a20 5570    ..Connection: Up
         144: 6772 6164 650d 0a53 6563 2d57 6562 536f    grade..Sec-WebSo
         160: 636b 6574 2d41 6363 6570 743a 2061 7935    cket-Accept: ay5
         176: 2f4b 6d72 3847 4662 6443 6e49 7a38 6846    /Kmr8GFbdCnIz8hF
         192: 6379 426e 546d 3349 3d0d 0a53 6563 2d57    cyBnTm3I=..Sec-W
         208: 6562 536f 636b 6574 2d50 726f 746f 636f    ebSocket-Protoco
         224: 6c3a 206e 6963 0d0a 0d0a                   l: nic....

   localhost -> localhost    TCP D=6080 S=37200 Push Ack=2859087799 Seq=4233630057 Len=6 Win=32768 Options=<nop,nop,tstamp 27031622 27030647>

           0: 0102 0002 0000 003a 0000 0001 0000 0000    .......:........
          16: 0000 0000 0000 0000 4500 003a 0000 4000    ........E..:..@.
          32: 4006 0000 7f00 0001 7f00 0001 9150 17c0    @............P..
          48: fc58 1169 aa6a 37b7 8018 8000 0026 0000    .X.i.j7......&..
          64: 0101 080a 019c 7846 019c 7477 8180 421d    ......xF..tw..B.
          80: 5f4e                                       _N

   localhost -> localhost    TCP D=37200 S=6080 Push Ack=4233629147 Seq=2859087957 Len=184 Win=32975 Options=<nop,nop,tstamp 27031652 27030647>

           0: 0102 0002 0000 00ec 0000 0001 0000 0000    ................
          16: 0000 0000 0000 0000 4500 00ec 0000 4000    ........E.....@.
          32: 3c06 0000 7f00 0001 7f00 0001 17c0 9150    <..............P
          48: aa6a 3855 fc58 0ddb 8018 80cf 00d8 0000    .j8U.X..........
          64: 0101 080a 019c 7864 019c 7477 817e 00b4    ......xd..tw.~..
          80: 5b7b 0a09 0922 6e61 6d65 223a 0922 7267    [{..."name":."rg
          96: 6530 222c 0a09 0922 756e 6978 7469 6d65    e0",..."unixtime
         112: 223a 0931 3537 3034 3535 3731 382c 0a09    ":.1570455718,..
         128: 0922 7278 7261 7465 223a 0930 2e30 3938    ."rxrate":.0.098
         144: 3632 3630 3539 3537 3337 3030 3939 322c    626059573700992,
         160: 0a09 0922 7478 7261 7465 223a 0930 2e32    ..."txrate":.0.2
         176: 3430 3231 3739 3237 3237 3835 3139 3233    4021792727851923
         192: 2c0a 0909 2272 7870 7073 223a 0930 2e39    ,..."rxpps":.0.9
         208: 3939 3933 3135 3334 3638 3738 3139 3932    9993153468781992
         224: 2c0a 0909 2274 7870 7073 223a 0930 2e39    ,..."txpps":.0.9
         240: 3939 3933 3135 3334 3638 3738 3139 3932    9993153468781992
         256: 0a09 7d5d                                  ..}]

   localhost -> localhost    TCP D=6080 S=37200 Push Ack=2859087799 Seq=4233630063 Len=6 Win=32768 Options=<nop,nop,tstamp 27032622 27030647>

           0: 0102 0002 0000 003a 0000 0001 0000 0000    .......:........
          16: 0000 0000 0000 0000 4500 003a 0000 4000    ........E..:..@.
          32: 4006 0000 7f00 0001 7f00 0001 9150 17c0    @............P..
          48: fc58 116f aa6a 37b7 8018 8000 0026 0000    .X.o.j7......&..
          64: 0101 080a 019c 7c2e 019c 7477 8180 50cd    ......|...tw..P.
          80: 51a8                                       Q.

   localhost -> localhost    TCP D=37200 S=6080 Push Ack=4233629147 Seq=2859088141 Len=179 Win=32975 Options=<nop,nop,tstamp 27032652 27030647>

           0: 0102 0002 0000 00e7 0000 0001 0000 0000    ................
          16: 0000 0000 0000 0000 4500 00e7 0000 4000    ........E.....@.
          32: 3c06 0000 7f00 0001 7f00 0001 17c0 9150    <..............P
          48: aa6a 390d fc58 0ddb 8018 80cf 00d3 0000    .j9..X..........
          64: 0101 080a 019c 7c4c 019c 7477 817e 00af    ......|L..tw.~..
          80: 5b7b 0a09 0922 6e61 6d65 223a 0922 7267    [{..."name":."rg
          96: 6530 222c 0a09 0922 756e 6978 7469 6d65    e0",..."unixtime
         112: 223a 0931 3537 3034 3535 3731 392c 0a09    ":.1570455719,..
         128: 0922 7278 7261 7465 223a 0931 2e35 3136    ."rxrate":.1.516
         144: 3337 3134 3836 3438 3730 3938 312c 0a09    3714864870981,..
         160: 0922 7478 7261 7465 223a 0931 312e 3538    ."txrate":.11.58
         176: 3930 3631 3932 3733 3131 3839 322c 0a09    9061927311892,..
         192: 0922 7278 7070 7322 3a09 3232 2e39 3936    ."rxpps":.22.996
         208: 3531 3037 3835 3431 3135 3438 2c0a 0909    510785411548,...
         224: 2274 7870 7073 223a 0933 332e 3939 3438    "txpps":.33.9948
         240: 3432 3033 3036 3038 3337 350a 097d 5d      42030608375..}]

   localhost -> localhost    TCP D=6080 S=37200 Push Ack=2859087799 Seq=4233630069 Len=6 Win=32768 Options=<nop,nop,tstamp 27033622 27030647>

           0: 0102 0002 0000 003a 0000 0001 0000 0000    .......:........
          16: 0000 0000 0000 0000 4500 003a 0000 4000    ........E..:..@.
          32: 4006 0000 7f00 0001 7f00 0001 9150 17c0    @............P..
          48: fc58 1175 aa6a 37b7 8018 8000 0026 0000    .X.u.j7......&..
          64: 0101 080a 019c 8016 019c 7477 8180 ba40    ..........tw...@
          80: aa13                                       ..

   localhost -> localhost    TCP D=37200 S=6080 Push Ack=4233629147 Seq=2859088320 Len=178 Win=32975 Options=<nop,nop,tstamp 27033652 27030647>

           0: 0102 0002 0000 00e6 0000 0001 0000 0000    ................
          16: 0000 0000 0000 0000 4500 00e6 0000 4000    ........E.....@.
          32: 3c06 0000 7f00 0001 7f00 0001 17c0 9150    <..............P
          48: aa6a 39c0 fc58 0ddb 8018 80cf 00d2 0000    .j9..X..........
          64: 0101 080a 019c 8034 019c 7477 817e 00ae    .......4..tw.~..
          80: 5b7b 0a09 0922 6e61 6d65 223a 0922 7267    [{..."name":."rg
          96: 6530 222c 0a09 0922 756e 6978 7469 6d65    e0",..."unixtime
         112: 223a 0931 3537 3034 3535 3732 302c 0a09    ":.1570455720,..
         128: 0922 7278 7261 7465 223a 0930 2e39 3330    ."rxrate":.0.930
         144: 3438 3130 3131 3736 3139 3939 2c0a 0909    481011761999,...
         160: 2274 7872 6174 6522 3a09 332e 3332 3335    "txrate":.3.3235
         176: 3634 3931 3530 3434 3935 3738 2c0a 0909    649150449578,...
         192: 2272 7870 7073 223a 0931 332e 3939 3732    "rxpps":.13.9972
         208: 3436 3336 3337 3134 3630 342c 0a09 0922    46363714604,..."
         224: 7478 7070 7322 3a09 3131 2e39 3937 3633    txpps":.11.99763
         240: 3937 3430 3332 3638 3034 0a09 7d5d         9740326804..}]

   localhost -> localhost    TCP D=6080 S=37200 Push Ack=2859087799 Seq=4233630075 Len=6 Win=32768 Options=<nop,nop,tstamp 27034621 27030647>

           0: 0102 0002 0000 003a 0000 0001 0000 0000    .......:........
          16: 0000 0000 0000 0000 4500 003a 0000 4000    ........E..:..@.
          32: 4006 0000 7f00 0001 7f00 0001 9150 17c0    @............P..
          48: fc58 117b aa6a 37b7 8018 8000 0026 0000    .X.{.j7......&..
          64: 0101 080a 019c 83fd 019c 7477 8180 efde    ..........tw....
          80: 8ef3                                       ..

   localhost -> localhost    TCP D=37200 S=6080 Push Ack=4233629147 Seq=2859088498 Len=180 Win=32975 Options=<nop,nop,tstamp 27034653 27030647>

           0: 0102 0002 0000 00e8 0000 0001 0000 0000    ................
          16: 0000 0000 0000 0000 4500 00e8 0000 4000    ........E.....@.
          32: 3c06 0000 7f00 0001 7f00 0001 17c0 9150    <..............P
          48: aa6a 3a72 fc58 0ddb 8018 80cf 00d4 0000    .j:r.X..........
          64: 0101 080a 019c 841d 019c 7477 817e 00b0    ..........tw.~..
          80: 5b7b 0a09 0922 6e61 6d65 223a 0922 7267    [{..."name":."rg
          96: 6530 222c 0a09 0922 756e 6978 7469 6d65    e0",..."unixtime
         112: 223a 0931 3537 3034 3535 3732 312c 0a09    ":.1570455721,..
         128: 0922 7278 7261 7465 223a 0930 2e38 3037    ."rxrate":.0.807
         144: 3435 3736 3333 3036 3432 3438 3839 2c0a    45763306424889,.
         160: 0909 2274 7872 6174 6522 3a09 332e 3437    .."txrate":.3.47
         176: 3838 3034 3737 3231 3938 3230 3837 2c0a    88047721982087,.
         192: 0909 2272 7870 7073 223a 0931 312e 3939    .."rxpps":.11.99
         208: 3736 3239 3235 3634 3631 3239 352c 0a09    7629256461295,..
         224: 0922 7478 7070 7322 3a09 3131 2e39 3937    ."txpps":.11.997
         240: 3632 3932 3536 3436 3132 3935 0a09 7d5d    629256461295..}]

   localhost -> localhost    TCP D=6080 S=37200 Push Ack=2859087799 Seq=4233630081 Len=6 Win=32768 Options=<nop,nop,tstamp 27035621 27030647>

           0: 0102 0002 0000 003a 0000 0001 0000 0000    .......:........
          16: 0000 0000 0000 0000 4500 003a 0000 4000    ........E..:..@.
          32: 4006 0000 7f00 0001 7f00 0001 9150 17c0    @............P..
          48: fc58 1181 aa6a 37b7 8018 8000 0026 0000    .X...j7......&..
          64: 0101 080a 019c 87e5 019c 7477 8180 cc78    ..........tw...x
          80: bdcf                                       ..

   localhost -> localhost    TCP D=37200 S=6080 Push Ack=4233629147 Seq=2859088678 Len=178 Win=32975 Options=<nop,nop,tstamp 27035653 27030647>

           0: 0102 0002 0000 00e6 0000 0001 0000 0000    ................
          16: 0000 0000 0000 0000 4500 00e6 0000 4000    ........E.....@.
          32: 3c06 0000 7f00 0001 7f00 0001 17c0 9150    <..............P
          48: aa6a 3b26 fc58 0ddb 8018 80cf 00d2 0000    .j;&.X..........
          64: 0101 080a 019c 8805 019c 7477 817e 00ae    ..........tw.~..
          80: 5b7b 0a09 0922 6e61 6d65 223a 0922 7267    [{..."name":."rg
          96: 6530 222c 0a09 0922 756e 6978 7469 6d65    e0",..."unixtime
         112: 223a 0931 3537 3034 3535 3732 322c 0a09    ":.1570455722,..
         128: 0922 7278 7261 7465 223a 0930 2e37 3432    ."rxrate":.0.742
         144: 3937 3830 3532 3030 3038 3537 322c 0a09    9780520008572,..
         160: 0922 7478 7261 7465 223a 0932 2e37 3339    ."txrate":.2.739
         176: 3534 3835 3037 3131 3438 3536 2c0a 0909    548507114856,...
         192: 2272 7870 7073 223a 0931 302e 3939 3732    "rxpps":.10.9972
         208: 3436 3735 3132 3937 3833 392c 0a09 0922    46751297839,..."
         224: 7478 7070 7322 3a09 382e 3939 3737 3437    txpps":.8.997747
         240: 3334 3139 3730 3935 3836 0a09 7d5d         3419709586..}]

   localhost -> localhost    TCP D=6080 S=37200 Push Ack=2859087799 Seq=4233630087 Len=6 Win=32768 Options=<nop,nop,tstamp 27036622 27030647>

           0: 0102 0002 0000 003a 0000 0001 0000 0000    .......:........
          16: 0000 0000 0000 0000 4500 003a 0000 4000    ........E..:..@.
          32: 4006 0000 7f00 0001 7f00 0001 9150 17c0    @............P..
          48: fc58 1187 aa6a 37b7 8018 8000 0026 0000    .X...j7......&..
          64: 0101 080a 019c 8bce 019c 7477 8180 2083    ..........tw.. .
          80: ff7c                                       .|

**Comment by zhiwenzheng** [comment]
The debug print I add cause the ws server core dump, so no reply sent.
the lighttpd is on another machine.

Now the proxy server hits an assert.
>
>[2019/10/07 22:22:42:7626] D: _realloc: size 214: lws_callback_ws_proxy
Assertion failed: 0, file /opt/FlowOS/projects/illumos-extra/libwebsockets/libwebsockets-3.2.0-32/lib/core/lws_dll2.c, line 115
Abort (core dumped)
```
void
lws_dll2_add_tail(struct lws_dll2 *d, struct lws_dll2_owner *owner)
{
	if (!lws_dll2_is_detached(d)) {
		assert(0); /* only wholly detached things can be added */
		return;
	}
```

**Comment by lws-team** [comment]
I pushed a fix for that on v3.2-stable

**Comment by zhiwenzheng** [comment]
It core dumped at the same place.

**Comment by lws-team** [comment]
There are two places the same in that function with the same call... I only fixed one (there's no line number info in your backtrace).  I updated the patch to fix both.

**Comment by zhiwenzheng** [comment]
It works now.
Thank you very much!
